judul_berita;portal_media;tanngal_publikasi;url;hasil_sentimen;olahan_teks
"Ganjar Anggap Prabowo, Gibran, dan Mahfud Md Punya PR Besar jika tidak 
Mundur dari Jabatannya";Metro;27/11/2023;https://metro.tempo.co/read/1802039/ganjar-anggap-prabowo-gibran-dan-mahfud-md-punya-pr-besar-jika-tidak-mundur-dari-jabatannya;netral;ganjar anggap prabowo gibran mahfud md pr mundur jabat
"Paulus Waterpauw Dilantik Jadi Ketua DPD Golkar, Airlangga Minta Menangkan 
Prabowo-Gibran - Kompas.com";Regional - KOMPAS.com;27/11/2023;https://regional.kompas.com/read/2023/11/27/175629878/paulus-waterpauw-dilantik-jadi-ketua-dpd-golkar-airlangga-minta-menangkan;netral;paulus waterpauw lantik ketua dpd golkar airlangga menang prabowo gibran kompas com
"Komunitas Vape Banten Ajak Anak Tongkrongan Pilih Prabowo-Gibran - 
harian.disway.id";Harian Disway;27/11/2023;https://harian.disway.id/read/746024/komunitas-vape-banten-ajak-anak-tongkrongan-pilih-prabowo-gibran;netral;komunitas vape banten ajak tongkrong pilih prabowo gibran disway
TKN Prabowo-Gibran Santai Terkait Projo Ganjar yang Gugat Jagoannya Ke PTUN;tvOneNews.com;27/11/2023;https://www.tvonenews.com/berita/169859-tkn-prabowo-gibran-santai-terkait-projo-ganjar-yang-gugat-jagoannya-ke-ptun;netral;tkn prabowo gibran santai kait projo ganjar gugat jago ptun
Thamrin Lamuasa Ditunjuk Jadi Ketua Tim Kampanye Prabowo-Gibran di Kaimana;Tribun Papua Barat;27/11/2023;https://papuabarat.tribunnews.com/2023/11/27/thamrin-lamuasa-ditunjuk-jadi-ketua-tim-kampanye-prabowo-gibran-di-kaimana;netral;thamrin lamuasa ketua tim kampanye prabowo gibran kaimana
"Relawan Prabowo-Gibran Sambut Pesta Demokrasi Dengan Riang Gembira - 
harian.disway.id";Harian Disway;27/11/2023;https://harian.disway.id/read/746020/relawan-prabowo-gibran-sambut-pesta-demokrasi-dengan-riang-gembira;netral;rawan prabowo gibran sambut pesta demokrasi riang gembira disway
"Helmi Abdullah Jadi Ketua TKD Prabowo-Gibran di Samarinda, Target 
Kemenangan 1 Putaran";Tribun Kaltim;27/11/2023;https://kaltim.tribunnews.com/2023/11/27/helmi-abdullah-jadi-ketua-tkd-prabowo-gibran-di-samarinda-target-kemenangan-1-putaran;netral;helm abdullah ketua tkd prabowo gibran samarinda target menang putar
"VIDEO EKSKLUSIF Target RK Menangkan Prabowo-Gibran di Jabar 60 Persen, Prof 
Muradi: Agak Berlebihan";Tribunnews.com;27/11/2023;https://www.tribunnews.com/nasional/2023/11/27/video-eksklusif-target-rk-menangkan-prabowo-gibran-di-jabar-60-persen-prof-muradi-agak-berlebihan;netral;video eksklusif target menang prabowo gibran jabar prof murad
"Prabowo-Gibran Punya Goyang Gemoy, Anies-Imin 'AMIN', Ganjar-Mahfud 
Disarankan Poles Gaya Kampanye";Tribun Trends;27/11/2023;https://trends.tribunnews.com/2023/11/27/prabowo-gibran-punya-goyang-gemoy-anies-imin-amin-ganjar-mahfud-disarankan-poles-gaya-kampanye;netral;prabowo gibran goyang gemoy anies amin ganjar mahfud saran poles gaya kampanye
"Jelang Kampanye Pemilu 2024 Anies-Muhaimin Mulai di Jabotabek, Prabowo 
Gibran Belum Ambil Cuti!";Tribun Pontianak;27/11/2023;https://pontianak.tribunnews.com/2023/11/27/jelang-kampanye-pemilu-2024-anies-muhaimin-mulai-di-jabotabek-prabowo-gibran-belum-ambil-cuti;netral;jelang kampanye milu anies muhaimin jabotabek prabowo gibran cuti
"Visi-misi pendidikan Prabowo-Gibran cs: Normatif dan bau kepentingan 
elektoral";Alinea.ID;27/11/2023;https://www.alinea.id/politik/misi-pendidikan-prabowo-gibran-cs-bau-kepentingan-elektoral-b2iaP9PoF;netral;visi misi didik prabowo gibran cs normatif bau elektoral
"Jaro Ade Targetkan Prabowo dan Gibran Menang Pilpres 2024 Satu Putaran - 
Radar Depok";Radar Depok;27/11/2023;https://www.radardepok.com/nasional/94611007053/jaro-ade-targetkan-prabowo-dan-gibran-menang-pilpres-2024-satu-putaran;netral;jaro ade target prabowo gibran menang pilpres putar radar depok
"Daftar Nama TKD Prabowo-Gibran di Tomohon Sulawesi Utara, Diisi Banyak 
Figur Populer";Tribun Manado;27/11/2023;https://manado.tribunnews.com/2023/11/27/daftar-nama-tkd-prabowo-gibran-di-tomohon-sulawesi-utara-diisi-banyak-figur-populer;netral;daftar nama tkd prabowo gibran tomohon sulawesi utara figur populer
TKD Prabowo-Gibran Sumut Gelar Doa dan Dzikir Bersama Anak Yatim;MitaNews;27/11/2023;https://mitanews.co.id/tkd-prabowo-gibran-sumut-gelar-doa-dan-dzikir-bersama-anak-yatim/;netral;tkd prabowo gibran sumut gelar doa dzikir yatim
Coattail Effect Prabowo-Gibran Angkat Elektabilitas Golkar Sulut;BeritaManado.com;27/11/2023;https://beritamanado.com/coattail-effect-prabowo-gibran-angkat-elektabilitas-golkar-sulut/;netral;coattail effect prabowo gibran angkat elektabilitas golkar sulut
Ini Perkiraan UMK 35 Kota dan Kabupaten di Jawa Tengah 2024;Bisnis Tempo;27/11/2023;https://bisnis.tempo.co/read/1802097/ini-perkiraan-umk-35-kota-dan-kabupaten-di-jawa-tengah-2024;netral;umk kota kabupaten
TKN Buka Suara soal Prabowo-Gibran Dituding Takut Debat;CNN Indonesia;28/11/2023;https://www.cnnindonesia.com/nasional/20231128175943-617-1030192/tkn-buka-suara-soal-prabowo-gibran-dituding-takut-debat;netral;tkn suara prabowo gibran tuding takut debat
Prabowo-Gibran Cuti 2 Kali Seminggu Selama Masa Kampanye;detikcom;28/11/2023;https://www.detik.com/jogja/berita/d-7061584/prabowo-gibran-cuti-2-kali-seminggu-selama-masa-kampanye;netral;prabowo gibran cuti kampanye
Tanpa Prabowo-Gibran, Tim Kampanye Bagi-bagi Susu dan ...;Kompas.id;28/11/2023;https://www.kompas.id/baca/polhuk/2023/11/28/tanpa-prabowo-gibran-tim-kampanye-bagi-bagi-susu-dan-makan-siang;netral;prabowo gibran tim kampanye susu
"TKN Prabowo-Gibran Mulai Kampanye, Bagi-bagi Makan Siang dan Susu Gratis di 
Seluruh Indonesia - Kompas.com";KOMPAS.com;28/11/2023;https://nasional.kompas.com/read/2023/11/28/15402701/tkn-prabowo-gibran-mulai-kampanye-bagi-bagi-makan-siang-dan-susu-gratis-di;netral;tkn prabowo gibran kampanye siang susu gratis indonesia kompas com
IKN Tak Cukup, Prabowo-Gibran Mau Bangun 10 Kota Inovasi;CNBC Indonesia;28/11/2023;https://www.cnbcindonesia.com/tech/20231128140906-37-492681/ikn-tak-cukup-prabowo-gibran-mau-bangun-10-kota-inovasi;netral;prabowo gibran bangun kota inovasi
Prabowo-Gibran pilih layani publik di hari pertama kampanye;Antaranews.com;28/11/2023;https://www.antaranews.com/video/3845106/prabowo-gibran-pilih-layani-publik-di-hari-pertama-kampanye;netral;prabowo gibran pilih layan publik kampanye
Kick Off Kampanye TKD Prabowo-Gibran di DIY: Sosialisasi Program Unggulan;detikcom;28/11/2023;https://www.detik.com/jogja/berita/d-7060945/kick-off-kampanye-tkd-prabowo-gibran-di-diy-sosialisasi-program-unggulan;netral;kick off kampanye tkd prabowo gibran diy sosialisasi program unggul
TKN Prabowo-Gibran Serahkan Bantuan Rp 5 Miliar untuk Palestina;detikNews;28/11/2023;https://news.detik.com/pemilu/d-7061008/tkn-prabowo-gibran-serahkan-bantuan-rp-5-miliar-untuk-palestina;netral;tkn prabowo gibran serah rp miliar palestina
"Otto Hasibuan Gabung TKN Prabowo-Gibran, Langsung Jadi Wakil Ketua - 
Kompas.com";KOMPAS.com;28/11/2023;https://nasional.kompas.com/read/2023/11/28/20192311/otto-hasibuan-gabung-tkn-prabowo-gibran-langsung-jadi-wakil-ketua;netral;otto hasibuan gabung tkn prabowo gibran ketua kompas com
Prabowo-Gibran Dijadwalkan Nonton Final Piala Dunia U-17 di Manahan Solo;detikcom;28/11/2023;https://www.detik.com/jateng/berita/d-7061290/prabowo-gibran-dijadwalkan-nonton-final-piala-dunia-u-17-di-manahan-solo;netral;prabowo gibran jadwal nonton final piala dunia manah solo
Isu Dinasti Politik Tidak Pengaruhi Prabowo-Gibran;Politik;28/11/2023;https://politik.rmol.id/read/2023/11/28/599182/unggul-di-survei-pengamat-isu-dinasti-politik-tak-pengaruhi-prabowo-gibran;netral;isu dinasti politik pengaruh prabowo gibran
Prabowo-Gibran Akan Hadir di Final Piala Dunia U-17 Solo - Kompas.com;KOMPAS.com;28/11/2023;https://nasional.kompas.com/read/2023/11/28/17555391/prabowo-gibran-akan-hadir-di-final-piala-dunia-u-17-solo;netral;prabowo gibran hadir final piala dunia solo kompas com
Unggul di Berbagai Lembaga Survei, Pengamat: Prabowo ...;Serayu News;28/11/2023;https://serayunews.com/unggul-di-berbagai-lembaga-survei-pengamat-prabowo-gibran-bukan-dinasti-politik;netral;unggul lembaga survei prabowo
"Kampanye Perdana Pilpres 2024, TKD Jabar Langsung Bergerak Perkenalkan 
Prabowo-Gibran";Bandung;28/11/2023;https://bandung.bisnis.com/read/20231128/549/1718880/kampanye-perdana-pilpres-2024-tkd-jabar-langsung-bergerak-perkenalkan-prabowo-gibran;netral;kampanye perdana pilpres tkd jabar gerak kenal prabowo gibran
Ini Manuver Golkar Menangkan Prabowo-Gibran di Daerah Timur Indonesia;Kabar24;28/11/2023;https://kabar24.bisnis.com/read/20231128/15/1718882/ini-manuver-golkar-menangkan-prabowo-gibran-di-daerah-timur-indonesia;netral;manuver golkar menang prabowo gibran daerah timur indonesia
Arus Baru Indonesia Bersama Prabowo Gibran Wujudkan ...;Mnctrijaya.com;28/11/2023;https://www.mnctrijaya.com/news/detail/63682/arus-baru-indonesia-bersama-prabowo-gibran-wujudkan-indonesia-maju;positif;indonesia prabowo gibran wujud
Berkaca pada Suara Jokowi, TKD Target Prabowo-Gibran Menang 80 Persen di NTT;Detik;28/11/2023;https://www.detik.com/bali/nusra/d-7061516/berkaca-pada-suara-jokowi-tkd-target-prabowo-gibran-menang-80-persen-di-ntt;netral;kaca suara jokowi tkd target prabowo gibran menang ntt
Forum Pendiri Demokrat Manuver ke Ganjar-Mahfud, Batal Dukung Prabowo-Gibran;Kabar24;28/11/2023;https://kabar24.bisnis.com/read/20231128/15/1718861/forum-pendiri-demokrat-manuver-ke-ganjar-mahfud-batal-dukung-prabowo-gibran;netral;forum demokrat manuver ganjar mahfud batal dukung prabowo gibran
Survei SPIN: Prabowo-Gibran Capres Pilihan Terkuat NU - Radar Jember;Radar Jember;28/11/2023;https://radarjember.jawapos.com/sinergi/793338716/survei-spin-prabowo-gibran-capres-pilihan-terkuat-nu;netral;survei spin prabowo gibran capres pilih kuat radar jember
TKN Prabowo-Gibran serahkan bantuan kemanusiaan untuk Palestina;Antaranews.com;28/11/2023;https://www.antaranews.com/video/3845007/tkn-prabowo-gibran-serahkan-bantuan-kemanusiaan-untuk-palestina;netral;tkn prabowo gibran serah manusia palestina
Soal Pernyataan Megawati, TKN Prabowo-Gibran: Bentuk ...;Politik;28/11/2023;https://politik.rmol.id/read/2023/11/28/599169/soal-pernyataan-megawati-tkn-prabowo-gibran-bentuk-kegelisahan-karena-jokowi-ogah-jadi-petugas-partai;netral;megawati tkn prabowo gibran bentuk
Partai Demokrat Siap Kampanye Bersama Prabowo-Gibran - Jawa Pos;JawaPos.com;28/11/2023;https://www.jawapos.com/politik/013340155/partai-demokrat-siap-kampanye-bersama-prabowo-gibran;netral;partai demokrat kampanye prabowo gibran pos
Respons Cak Imin Soal Khofifah Condong Dukung Prabowo-Gibran;Detik;28/11/2023;https://www.detik.com/jatim/berita/d-7061657/respons-cak-imin-soal-khofifah-condong-dukung-prabowo-gibran;netral;respons cak khofifah condong dukung prabowo gibran
Rumah Demokrasi G8C Siap Kumpulkan Dukungan TKI Untuk Prabowo-Gibran;JPNN.com;28/11/2023;https://www.jpnn.com/news/rumah-demokrasi-g8c-siap-kumpulkan-dukungan-tki-untuk-prabowo-gibran;netral;rumah demokrasi kumpul dukung tki prabowo gibran
Prabowo-Gibran Terima Dukungan dari TKI, Diyakini Raup 80 ...;Merdeka.com;28/11/2023;https://www.merdeka.com/politik/prabowo-gibran-terima-dukungan-dari-tki-diyakini-raup-80-persen-suara-dari-luar-negeri-54759-mvk.html;netral;prabowo gibran terima dukung tki raup
Beredar 'Tabloid Indonesia Maju' di Solo, Gibran: Nggak Tahu;Detik;28/11/2023;https://www.detik.com/jateng/berita/d-7061338/beredar-tabloid-indonesia-maju-di-solo-gibran-nggak-tahu;netral;tabloid indonesia maju solo gibran
"Tak Didukung Jokowi, Pemilih Ganjar dan PDIP Pindah ke Prabowo-Gibran - 
Radar Semarang";Radar Semarang;28/11/2023;https://radarsemarang.jawapos.com/nasional/723339947/tak-didukung-jokowi-pemilih-ganjar-dan-pdip-pindah-ke-prabowo-gibran;netral;dukung jokowi pilih ganjar pdip pindah prabowo gibran radar sarang
"SBY Akan Turun Gunung Ke Kandang Banteng Rapat Konsolidasi Kemenangan 
Prabowo Gibran di Sragen";joglosemar news;28/11/2023;https://joglosemarnews.com/2023/11/sby-akan-turun-gunung-ke-kandang-banteng-rapat-konsolidasi-kemenangan-prabowo-gibran-di-sragen/;netral;sby turun gunung kandang banteng rapat konsolidasi menang prabowo gibran sragen
Komunitas Disabilitas Deklarasi Dukung Dukung Prabowo-Gibran;Liputan6.com;28/11/2023;https://www.liputan6.com/pemilu/read/5466739/komunitas-disabilitas-deklarasi-dukung-dukung-prabowo-gibran;netral;komunitas disabilitas deklarasi dukung dukung prabowo gibran
Ketua DPW PA Pimpin Ketua TKD Prabowo-Gibran Aceh Utara;Serambi Indonesia;28/11/2023;https://aceh.tribunnews.com/2023/11/28/ketua-dpw-pa-pimpin-ketua-tkd-prabowo-gibran-aceh-utara;netral;ketua dpw pimpin ketua tkd prabowo gibran aceh utara
Program Kartu Usaha Startup Prabowo-Gibran Dinilai Sangat Membantu Milenial;Tribun Jabar;28/11/2023;https://jabar.tribunnews.com/2023/11/28/program-kartu-usaha-startup-prabowo-gibran-dinilai-sangat-membantu-milenial;positif;program kartu usaha startup prabowo gibran nilai milenial
"Dukung Program Kesehatan Prabowo-Gibran, Repnas Gelar Bakti Kesehatan di 
Jepara - harian.disway.id";Harian Disway;28/11/2023;https://harian.disway.id/read/746251/dukung-program-kesehatan-prabowo-gibran-repnas-gelar-bakti-kesehatan-di-jepara;netral;dukung program sehat prabowo gibran repnas gelar bakti sehat jepara disway
"Tanggapan Ganjar Pranowo Soal Gimmick Gemoy yang Dinarasikan ke 
Prabowo-Gibran";Bangka Pos;28/11/2023;https://bangka.tribunnews.com/2023/11/28/tanggapan-ganjar-pranowo-soal-gimmick-gemoy-yang-dinarasikan-ke-prabowo-gibran;netral;tanggap ganjar pranowo gimmick gemoy narasi prabowo gibran
"Agenda Kampanye Hari Pertama Capres-Cawapres: Anies-Cak Imin, 
Prabowo-Gibran dan Ganjar-Mahfud MD";Bangka Pos;28/11/2023;https://bangka.tribunnews.com/2023/11/28/agenda-kampanye-hari-pertama-capres-cawapres-anies-cak-imin-prabowo-gibran-dan-ganjar-mahfud-md;netral;agenda kampanye capres cawapres anies cak prabowo gibran ganjar mahfud md
Ibu Kota Pindah ke IKN, Tim Kampanye Prabowo-Gibran ...;KOMPAS.com;28/11/2023;https://video.kompas.com/watch/1060707/ibu-kota-pindah-ke-ikn-tim-kampanye-prabowo-gibran-sebut-niat-baik-pemerintah;netral;kota pindah tim kampanye prabowo gibran
Pimpin Gibran Center Sultra, Yusran Akbar Siap Menangkan ...;kendaripos;28/11/2023;https://kendaripos.fajar.co.id/2023/11/28/pimpin-gibran-center-sultra-yusran-akbar-siap-menangkan-prabowo-gibran/;netral;pimpin gibran center sultra yusran akbar menang
"Soal Pernyataan Komandan Polri Diduga Bantu Menangkan Prabowo-Gibran, 
Aiman: Saya Hanya Mengingatkan";Metro;28/11/2023;https://metro.sindonews.com/read/1263057/170/soal-pernyataan-komandan-polri-diduga-bantu-menangkan-prabowo-gibran-aiman-saya-hanya-mengingatkan-1701169881;netral;komandan polri duga menang prabowo gibran
"Masa Kampanye Dimulai, Relawan Bolone Mase Jepara Ikut Bergerak Menangkan 
Prabowo-Gibran";Warta Kota;28/11/2023;https://wartakota.tribunnews.com/2023/11/28/masa-kampanye-dimulai-relawan-bolone-mase-jepara-ikut-bergerak-menangkan-prabowo-gibran;netral;kampanye rawan bolone mase jepara gerak menang prabowo gibran
"PDIP Tak Yakin Prabowo-Gibran Bakal Kuasai Jabar: Versi Kami di Bawah 40% - 
kumparan.com";kumparan;28/11/2023;https://kumparan.com/kumparannews/pdip-tak-yakin-prabowo-gibran-bakal-kuasai-jabar-versi-kami-di-bawah-40-21fJamQFooe;netral;pdip prabowo gibran kuasa jabar versi kumpar com
"Adu Argumen Antara Jubir Ganjar-Mahfud dengan Jubir Prabowo-Gibran | Dua 
Arah";KOMPAS.tv;28/11/2023;https://www.kompas.tv/talkshow/464710/adu-argumen-antara-jubir-ganjar-mahfud-dengan-jubir-prabowo-gibran-dua-arah;netral;argumen juru bicara ganjar mahfud juru bicara prabowo gibran arah
Agenda Kampanye Prabowo-Gibran Masih Dimatangkan;Kompas.id;29/11/2023;https://www.kompas.id/baca/polhuk/2023/11/29/belum-selesai-agenda-kampanye-prabowo-gibran-masih-dimatangkan;netral;agenda kampanye prabowo gibran matang
"Jubir TKN Prabowo-Gibran: Kami Tak Akan Balas Fitnah dengan Fitnah, Fokus 
Perkenalkan Paslon - Kompas.com";KOMPAS.com;29/11/2023;https://nasional.kompas.com/read/2023/11/29/18152651/jubir-tkn-prabowo-gibran-kami-tak-akan-balas-fitnah-dengan-fitnah-fokus;netral;juru bicara tkn prabowo gibran balas fitnah fitnah fokus kenal paslon kompas com
Mulia Betul! Pentingkan Layani Masyarakat, Dua Hari Ini ...;Emitennews.com;29/11/2023;https://www.emitennews.com/news/mulia-betul-pentingkan-layani-masyarakat-dua-hari-ini-prabowo-gibran-tidak-kampanye;positif;mulia layan masyarakat
"Jubir TKN Prabowo-Gibran: Narasi ""Gemoy"" ""Catchy"" untuk Bikin Milenial dan 
Gen Z Melirik - Kompas.com";KOMPAS.com;29/11/2023;https://nasional.kompas.com/read/2023/11/29/23212531/jubir-tkn-prabowo-gibran-narasi-gemoy-catchy-untuk-bikin-milenial-dan-gen-z;netral;juru bicara tkn prabowo gibran narasi gemoy catchy bikin milenial z lirik kompas com
"Airlangga Hartarto Bakal Turun Gunung Kampanyekan Prabowo-Gibran - 
Kompas.com";KOMPAS.com;29/11/2023;https://nasional.kompas.com/read/2023/11/29/16095021/airlangga-hartarto-bakal-turun-gunung-kampanyekan-prabowo-gibran;netral;airlangga hartarto turun gunung kampanye prabowo gibran kompas com
TKN targetkan Prabowo-Gibran menang 60 persen di Jabar;Antaranews.com;29/11/2023;https://www.antaranews.com/berita/3847254/tkn-targetkan-prabowo-gibran-menang-60-persen-di-jabar;netral;tkn target prabowo gibran menang jabar
Gus Miftah Ajak NU Kultural Sidoarjo Dukung Prabowo dan ...;Kompas.id;29/11/2023;https://www.kompas.id/baca/nusantara/2023/11/29/ajak-nu-kultural-sidoarjo-dukung-prabowo-dan-gibran;netral;miftah ajak kultural sidoarjo dukung prabowo
Kaesang soal kampanye bersama Prabowo-Gibran: Saya fokus PSI;Antaranews.com;29/11/2023;https://www.antaranews.com/berita/3847131/kaesang-soal-kampanye-bersama-prabowo-gibran-saya-fokus-psi;netral;kaesang kampanye prabowo gibran fokus psi
Dipimpin Otto Hasibuan, AAIB Jabar Deklarasi Dukung Prabowo-Gibran;detikNews;29/11/2023;https://news.detik.com/pemilu/d-7063683/dipimpin-otto-hasibuan-aaib-jabar-deklarasi-dukung-prabowo-gibran;netral;pimpin otto hasibuan aaib jabar deklarasi dukung prabowo gibran
Relawan PGN Optimistis Prabowo-Gibran Menang 1 Putaran;Soloraya;29/11/2023;https://soloraya.solopos.com/relawan-pgn-optimistis-prabowo-gibran-menang-1-putaran-1808050;netral;rawan pgn optimistis prabowo gibran menang putar
"Cara Kampanye Tim Sukses Capres Prabowo-Gibran di NTT, Bagikan Makanan 
Bergizi untuk Anak Stunting - Kompas.com";Regional - KOMPAS.com;29/11/2023;https://regional.kompas.com/read/2023/11/29/183719078/cara-kampanye-tim-sukses-capres-prabowo-gibran-di-ntt-bagikan-makanan;netral;kampanye tim sukses capres prabowo gibran ntt gizi stunting kompas com
Dukung Prabowo-Gibran, Sejumlah Aktivis 98 Tepis Soal Isu Neo Orde Baru;JPNN.com;29/11/2023;https://www.jpnn.com/news/dukung-prabowo-gibran-sejumlah-aktivis-98-tepis-soal-isu-neo-orde-baru;netral;dukung prabowo gibran aktivis tepis isu neo orde
KSPN Sampaikan Gagasan ke TKN Prabowo-Gibran;Politik;29/11/2023;https://politik.rmol.id/read/2023/11/29/599360/kspn-sampaikan-gagasan-ke-tkn-prabowo-gibran;netral;kspn gagas tkn prabowo gibran
"Kombinasi Ideal Senior dan Junior jadi Alasan Warga Indonesia Pilih 
Prabowo-Gibran";Tribun Jabar;29/11/2023;https://jabar.tribunnews.com/2023/11/29/kombinasi-ideal-senior-dan-junior-jadi-alasan-warga-indonesia-pilih-prabowo-gibran;netral;kombinasi ideal senior junior alas indonesia pilih prabowo gibran
Serba-serbi Hari Pertama Kampanye Anies-Muhaimin ...;KOMPAS.com;29/11/2023;https://nasional.kompas.com/read/2023/11/29/05450091/serba-serbi-hari-pertama-kampanye-anies-muhaimin-prabowo-gibran-dan-ganjar?page=all;netral;serba serbi kampanye anies muhaimin
Alasan TKN Prabowo-Gibran gunakan istilah ‘gemoy’ saat kampanye;Antaranews.com;29/11/2023;https://www.antaranews.com/video/3847347/alasan-tkn-prabowo-gibran-gunakan-istilah-gemoy-saat-kampanye;netral;alas tkn prabowo gibran istilah gemoy kampanye
Fokus Tingkatkan Kualitas SDM, Prabowo-Gibran Konkret Majukan Indonesia;Tribun Jabar;29/11/2023;https://jabar.tribunnews.com/2023/11/29/fokus-tingkatkan-kualitas-sdm-prabowo-gibran-konkret-majukan-indonesia;netral;fokus kualitas sdm prabowo gibran konkret maju indonesia
Dedi Mulyadi Kampanyekan Prabowo-Gibran dengan Safari Cinta di Subang;Liputan6.com;29/11/2023;https://www.liputan6.com/regional/read/5467601/dedi-mulyadi-kampanyekan-prabowo-gibran-dengan-safari-cinta-di-subang;netral;dedi mulyadi kampanye prabowo gibran safari cinta subang
TKN Prabowo-Gibran Targetkan Raup 60% Suara di Jabar;Medcom.id;29/11/2023;https://www.medcom.id/pemilu/news-pemilu/9K5AjJnK-tkn-prabowo-gibran-targetkan-raup-60-suara-di-jabartkn-prabowo-gibran-targetkan-raup-60-suara-di-jabar;netral;tkn prabowo gibran target raup suara jabar
Airlangga Pribadi: Pasangan Prabowo-Gibran Sering Absen ...;kanalsatu.com;29/11/2023;http://kanalsatu.com/id/post/61834/airlangga-pribadi--pasangan-prabowo-gibran-sering-absen-diskusi-publik-/airlangga-pribadi--pasangan-prabowo-gibran-sering-absen-diskusi-publik-;netral;airlangga pribadi pasang prabowo gibran absen
"Tak Gentar di Prabowo-Gibran Ada Ridwan Kamil, TPD Anies-Cak Imin Jabar 
Pamer Aher";Liputan6.com;29/11/2023;https://www.liputan6.com/pemilu/read/5468163/tak-gentar-di-prabowo-gibran-ada-ridwan-kamil-tpd-anies-cak-imin-jabar-pamer-aher;netral;gentar prabowo gibran ridwan tpd anies cak jabar pamer aher
Prabowo-Gibran Optimis Menang di Kalsel, Target Raih 51 ...;Sonora.id;29/11/2023;https://www.sonora.id/read/423957282/prabowo-gibran-optimis-menang-di-kalsel-target-raih-51-persen-suara;netral;prabowo gibran optimis menang kalsel target raih
Dana Abadi Pesantren Langkah Konkret Prabowo-Gibran Peduli Kepentingan Umat;Tribun Jabar;29/11/2023;https://jabar.tribunnews.com/2023/11/29/dana-abadi-pesantren-langkah-konkret-prabowo-gibran-peduli-kepentingan-umat;netral;dana abadi pesantren langkah konkret prabowo gibran peduli umat
Serikat Pekerja Nusantara Dukung Prabowo-Gibran di Pilpres ...;20detik;29/11/2023;https://20.detik.com/detikupdate/20231129-231129134/serikat-pekerja-nusantara-dukung-prabowo-gibran-di-pilpres-2024;netral;serikat nusantara dukung prabowo gibran pilpres
Netizen Bongkar Jadwal Uji Publik Capres-Cawapres ...;jurnas.com;29/11/2023;https://www.jurnas.com/artikel/147544/Netizen-Bongkar-Jadwal-Uji-Publik-Capres-Cawapres-Prabowo-Gibran-Banjir-Komentar-Miring/;netral;netizen bongkar jadwal uji publik capres cawapres
"Forum Pendiri Demokrat Tarik Dukungan ke Prabowo karena Gibran dan Polemik 
MK - Kompas.com";KOMPAS.com;29/11/2023;https://nasional.kompas.com/read/2023/11/29/08454151/forum-pendiri-demokrat-tarik-dukungan-ke-prabowo-karena-gibran-dan-polemik?page=all;netral;forum demokrat tarik dukung prabowo gibran polemik mk kompas com
[Cek Fakta] Jokowi Bertemu CEO TikTok Kondisikan Algoritma ...;Medcom.id;29/11/2023;https://www.medcom.id/telusur/cek-fakta/9K5AjlxK-cek-fakta-jokowi-bertemu-ceo-tiktok-kondisikan-algoritma-prabowo-gibran-ini-faktanya;netral;cek fakta jokowi ceo tiktok algoritma
Punya Hitungan By Data, Relawan Prabowo-Gibran di Kota ...;RMOL Jabar;29/11/2023;https://www.rmoljabar.id/punya-hitungan-by-data-relawan-prabowo-gibran-di-kota-cirebon-targetkan-70-persen-suara;netral;hitung by rawan prabowo gibran kota
"TKN Prabowo-Gibran Tanggapi Cak Imin soal 'Indonesia dalam Bahaya' - 
kumparan.com";kumparan;29/11/2023;https://kumparan.com/kumparannews/tkn-prabowo-gibran-tanggapi-cak-imin-soal-indonesia-dalam-bahaya-21g2yRtwxwK;netral;tkn prabowo gibran tanggap cak indonesia dalam bahaya kumpar com
Kompak, Warga Pelosok Desa di Kebumen Deklarasikan ...;Kebumen24.com;29/11/2023;https://kebumen24.com/kompak-warga-pelosok-desa-di-kebumen-deklarasikan-dukung-kemenangan-prabowo-gibran-di-pilpres/;netral;kompak pelosok desa kebumen deklarasi
TKD Prabowo-Gibran Kabupaten Padang Lawas Terbentuk ...;Mata Peristiwa;29/11/2023;https://mataperistiwa.id/2023/11/29/tkd-prabowo-gibran-kabupaten-padang-lawas-terbentuk-ini-penjelasannya/;netral;tkd prabowo gibran kabupaten padang lawas bentuk
"Melalui Diskusi Panjang, 500 Eks Babinsa Deklarasi Dukung Prabowo-Gibran di 
Pilpres 2024";Tribun Jatim;29/11/2023;https://jatim.tribunnews.com/2023/11/29/melalui-diskusi-panjang-500-eks-babinsa-deklarasi-dukung-prabowo-gibran-di-pilpres-2024;netral;diskusi eks babinsa deklarasi dukung prabowo gibran pilpres
Menyesatkan, Video Selawat Habib Syech yang Diklaim ...;Cek Fakta Tempo;29/11/2023;https://cekfakta.tempo.co/fakta/2580/menyesatkan-video-selawat-habib-syech-yang-diklaim-sebagai-dukungan-pkb-prabowo-gibran-satu-putaran;negatif;sesat video selawat habib syech klaim
Dukung Prabowo Gibran Perangkat Desa Langgar Aturan? | NILUH;KOMPAS.tv;29/11/2023;https://www.kompas.tv/video/465123/dukung-prabowo-gibran-perangkat-desa-langgar-aturan-niluh;negatif;dukung prabowo gibran perangkat desa langgar atur niluh
Relawan Tegak Lurus Jokowi 2024 Fogging dan Pasang APK ...;HarianSIB.com;29/11/2023;https://www.hariansib.com/detail/Medan-Sekitarnya/Relawan-Tegak-Lurus-Jokowi-2024-Fogging-dan-Pasang-APK-Prabowo-Gibran;negatif;rawan tegak lurus jokowi fogging pasang
Daftar Nama Tim Kampanye Daerah Prabowo dan Gibran di Bone Bolango Gorontalo;Tribun Gorontalo;29/11/2023;https://gorontalo.tribunnews.com/2023/11/29/daftar-nama-tim-kampanye-daerah-prabowo-dan-gibran-di-bone-bolango-gorontalo;netral;daftar nama tim kampanye daerah prabowo gibran bone bolango gorontalo
Ketua KPK Tersangka, Tim Anies, Ganjar & Prabowo Sepakat Ini;CNBC Indonesia;29/11/2023;https://www.cnbcindonesia.com/news/20231129212408-8-493180/ketua-kpk-tersangka-tim-anies-ganjar-prabowo-sepakat-ini;netral;ketua kpk sangka tim anies ganjar prabowo sepakat
"Tolak Konser Indonesia Maju Dianggap Kampanye Prabowo-Gibran, Ini 
Penjelasan Gus Miftah";Tribun Solo;29/11/2023;https://solo.tribunnews.com/2023/11/29/tolak-konser-indonesia-maju-dianggap-kampanye-prabowo-gibran-ini-penjelasan-gus-miftah;netral;tolak konser indonesia maju anggap kampanye prabowo gibran miftah
