judul_berita;portal_media;tanngal_publikasi;url;hasil_sentimen;olahan_teks
Sukarelawan Prabowo-Gibran Gelar Lomba Desain Gemoy hingga Bobby The Cat;JPNN.com;9/12/2023;https://www.jpnn.com/news/sukarelawan-prabowo-gibran-gelar-lomba-desain-gemoy-hingga-bobby-the-cat;netral;sukarelawan prabowo gibran gelar lomba desain gemoy bobby cat
"Terungkap! Deklarasi Prabowo-Gibran Massa Bayaran Rp50.000/Orang, Warga 
Wadas Merasa Diadu Domba";Tribun Muria;9/12/2023;https://muria.tribunnews.com/2023/12/09/terungkap-deklarasi-prabowo-gibran-oleh-massa-bayaran-rp50000orang-warga-merasa-diadu-domba;negatif;deklarasi prabowo gibran massa bayar rp wadas domba
"Kontroversi Usulan TKN Prabowo-Gibran Terkait Debat, Pakai Bahasa Inggris 
hingga Tanpa Sanggahan";Tribunnews.com;9/12/2023;https://www.tribunnews.com/mata-lokal-memilih/2023/12/09/kontroversi-usulan-tkn-prabowo-gibran-terkait-debat-pakai-bahasa-inggris-hingga-tanpa-sanggahan;negatif;kontroversi usul tkn prabowo gibran kait debat pakai bahasa inggris sanggah
Klarifikasi Deklarasi Dukungan Pasangan Prabowo Gibran ...;Detik Peristiwa;9/12/2023;https://www.detikperistiwa.com/news-619559/klarifikasi-deklarasi-dukungan-pasangan-prabowo-gibran-atas-nama-gusdurian.html;netral;klarifikasi deklarasi dukung pasang prabowo gibran
Relawan Pedagang Indonesia Maju Deklarasi Dukung ...;Penasultra.com;9/12/2023;https://penasultra.com/relawan-pedagang-indonesia-maju-deklarasi-dukung-capres-prabowo-gibran/;positif;rawan dagang indonesia maju deklarasi dukung
"Dukung Program Sosialisasi Prabowo Gibran, Bara JP Sumut Berbagi Bubur dan 
Telur Rebus";Detak Sumut;9/12/2023;https://sumut.pikiran-rakyat.com/politik/pr-3387455554/dukung-program-sosialisasi-prabowo-gibran-bara-jp-sumut-berbagi-bubur-dan-telur-rebus;netral;dukung program sosialisasi prabowo gibran jp sumut bubur telur rebus
Ganjar–Mahfud Nobar, Prabowo–Gibran Konsolidasi;NUSABALI.com;9/12/2023;https://www.nusabali.com/berita/156617/ganjar-mahfud-nobar-prabowo-gibran-konsolidasi;netral;ganjar mahfud nonton bareng prabowo gibran konsolidasi
Ketua TKN: Prabowo-Gibran akan Berusaha Kampanye ...;Rejogja;9/12/2023;https://rejogja.republika.co.id/berita/s5dxl1291/ketua-tkn-prabowogibran-akan-berusaha-kampanye-secara-efisien;netral;ketua tkn prabowo gibran usaha kampanye
Relawan Beta Gibran NTT Komit Menangkan Prabowo-Gibran;Timex Kupang;9/12/2023;https://timexkupang.fajar.co.id/2023/12/09/relawan-beta-gibran-ntt-komit-menangkan-prabowo-gibran/;netral;rawan beta gibran ntt komit menang prabowo gibran
Ratusan Warga Banjaranyar Banjarsari Deklarasikan ...;Info Priangan Group -;9/12/2023;https://infopriangan.com/ratusan-warga-banjaranyar-banjarsari-deklarasikan-prabowo-gibran/;netral;ratus banjaranyar banjarsari deklarasi
Ribuan Massa Gerindra Kediri, Siap Menangkan Prabowo – Gibran;kediritangguh.co;9/12/2023;https://kediritangguh.co/ribuan-massa-gerindra-kediri-siap-menangkan-prabowo-gibran/;netral;massa gerindra menang prabowo gibran
"Dukungan Prabowo-Gibran di Kediri Menguat, LMDH Bolone Mase Gelar Deklarasi 
Kemenangan";iNews Blitar;9/12/2023;https://blitar.inews.id/read/380507/dukungan-prabowo-gibran-di-kediri-menguat-lmdh-bolone-mase-gelar-deklarasi-kemenangan;netral;dukung prabowo gibran kuat lmdh bolone mase gelar deklarasi menang
Relawan Prabowo-Gibran di Sumbar Bakal Door to Door ke ...;Prokabar;9/12/2023;https://prokabar.com/relawan-prabowo-gibran-di-sumbar-bakal-door-to-door-ke-500-000-rumah-warga/;netral;rawan prabowo gibran sumbar door door
Repnas Kalsel Siap Menangkan Prabowo-Gibran;Duta TV;9/12/2023;https://dutatv.com/repnas-kalsel-siap-menangkan-prabowo-gibran/;netral;repnas kalsel menang prabowo gibran
Ribuan Posko Pemenangan Prabowo-Gibran di Kandang ...;JPNN.com;9/12/2023;https://www.jpnn.com/video/ribuan-posko-pemenangan-prabowo-gibran-di-kandang-banteng-butet-diduga-diintimidasi-reaction-jpnncom;netral;posko menang prabowo gibran kandang
DPC Gerindra Rekrut 500 Koordinator TPS Menangkan ...;presmedia.id;9/12/2023;https://presmedia.id/berita-81204/dpc-gerindra-rekrut-500-koordinator-tps-menangkan-prabowo-gibran-di-tanjungpinang-pemilu-2024.html;netral;dpc gerindra rekrut koordinator tps menang
AIA: Prabowo – Gibran Target Raih Suara 60 Persen di Sulsel;Enewsindonesia.com;9/12/2023;https://enewsindonesia.com/aia-prabowo-gibran-target-raih-suara-60-persen-di-sulsel/;netral;aia prabowo gibran target raih suara sulsel
"Turun Gunung ke Tulungagung, SBY Ajak Kader Demokrat Menangkan 
Prabowo-Gibran";BeritaSatu.com;9/12/2023;https://www.beritasatu.com/bersatu-kawal-pemilu/2785904/turun-gunung-ke-tulungagung-sby-ajak-kader-demokrat-menangkan-prabowo-gibran;netral;turun gunung tulungagung sby ajak kader demokrat menang prabowo gibran
"Temuan SMRC: Isu HAM Prabowo Pengaruhi Elektabilitas Ganjar-Mahfud, Ini 
Penjelasannya";Kabar24;9/12/2023;https://kabar24.bisnis.com/read/20231209/15/1722443/temuan-smrc-isu-ham-prabowo-pengaruhi-elektabilitas-ganjar-mahfud-ini-penjelasannya;netral;smrc isu ham prabowo pengaruh elektabilitas ganjar mahfud
"7 Cara Istimewa KDM Sosialisasikan Pasangan Prabowo-Gibran, Nomor Tujuh 
Sangat Menghibur - Lensa Purwakarta";Lensa Purwakarta;9/12/2023;https://www.lensapurwakarta.com/nasional/28511143299/7-cara-istimewa-kdm-sosialisasikan-pasangan-prabowo-gibran-nomor-tujuh-sangat-menghibur;netral;istimewa kdm sosialisasi pasang prabowo gibran nomor tujuh hibur lensa purwakarta
"Mayoritas Masyarakat Percaya Prabowo-Gibran Bukan Politik Dinasti - Radar 
Surabaya";Radar Surabaya;9/12/2023;https://radarsurabaya.jawapos.com/nasional/773456395/mayoritas-masyarakat-percaya-prabowo-gibran-bukan-politik-dinasti;netral;mayoritas masyarakat percaya prabowo gibran politik dinasti radar surabaya
Gerindra Klaim 'Gemoy' Menarik Suara Prabowo-Gibran di Jatim;IDN Times Jatim;9/12/2023;https://jatim.idntimes.com/news/jatim/khusnul-hasana/gerindra-klaim-gemoy-menarik-suara-prabowo-gibran-di-jatim;netral;gerindra klaim gemoy tarik suara prabowo gibran jatim
TKN Prabowo-Gibran: Kandidat yang Lain hanya Bisa Jalan ...;Eramuslim;9/12/2023;https://www.eramuslim.com/berita/nasional/tkn-prabowo-gibran-kandidat-yang-lain-hanya-bisa-jalan-jalan-nggak-punya-gagasan/;netral;tkn prabowo gibran kandidat
"Abuya Muhtadi Tetap Berada di Kubu Ganjar-Mahfud, Meski Telah Dikunjungi 
Prabowo-Gibran - Publik Satu";PublikSatu;9/12/2023;https://www.publiksatu.co/nasional/1523454588/abuya-muhtadi-tetap-berada-di-kubu-ganjar-mahfud-meski-telah-dikunjungi-prabowo-gibran;netral;abuya muhtadi kubu ganjar mahfud kunjung prabowo gibran publik
Senjata Anies-Cak Imin Menyerang Prabowo-Gibran, Beda ke Ganjar-Mahfud MD;Tribun-medan.com;9/12/2023;https://medan.tribunnews.com/2023/12/09/senjata-anies-cak-imin-menyerang-prabowo-gibran-beda-ke-ganjar-mahfud-md;netral;senjata anies cak serang prabowo gibran beda ganjar mahfud md
Kherlani dan Azwar Yacub Ajak Warga Kebun Kelapa Pilih ...;sumatera post;9/12/2023;https://sumaterapost.co/kherlani-dan-azwar-yacub-ajak-warga-kebun-kelapa-pilih-prabowo-gibran/;netral;kherlani azwar yacub ajak kebun kelapa pilih
"Star Kampanye, Ahmad Hidayat Mus Arahkan Warga Pulau Taliabu Menangkan 
Prabowo-Gibran & Caleg Golkar";Tribun Video;9/12/2023;https://video.tribunnews.com/view/680348/star-kampanye-ahmad-hidayat-mus-arahkan-warga-pulau-taliabu-menangkan-prabowo-gibran-caleg-golkar;netral;star kampanye ahmad hidayat mus arah pulau taliabu menang prabowo gibran caleg golkar
Gibran disebut sebagai simbol Orde Muda pembawa perubahan anak muda;Antaranews.com;9/12/2023;https://www.antaranews.com/berita/3863760/gibran-disebut-sebagai-simbol-orde-muda-pembawa-perubahan-anak-muda;netral;gibran simbol orde muda ubah muda
"Dana Kampanye Prabowo-Gibran Kalahkan Pasangan AMIN dan Ganjar-Mahfud, Ini 
Rinciannya";Konteks.co.id;9/12/2023;https://www.konteks.co.id/nasional/211357/dana-kampanye-prabowo-gibran-kalahkan-pasangan-amin-dan-ganjar-mahfud/;netral;dana kampanye prabowo gibran pasang amin ganjar mahfud rinciannya
"Desain Paslon di Surat Suara Tampak Menarik, Ini Tampilan Anies-Muhaimin, 
Prabowo-Gibran, Ganjar-Mahfud";Suara Lidik;9/12/2023;https://www.suaralidik.com/desain-paslon-di-surat-suara-tampak-menarik-ini-tampilan-anies-muhaimin-prabowo-gibran-ganjar-mahfud/;netral;desain paslon surat suara tarik anies muhaimin prabowo gibran ganjar mahfud
"Otto Hasibuan Sebut Peradi Tak Dukung Capres-Cawapres Tertentu di Pilpres 
2024";Nasional;9/12/2023;https://nasional.tempo.co/read/1807275/otto-hasibuan-sebut-peradi-tak-dukung-capres-cawapres-tertentu-di-pilpres-2024;netral;otto hasibuan radi dukung capres cawapres pilpres
"Pengamat Berharap Anies, Prabowo, dan Ganjar Arahkan Isu IKN ke Persoalan 
Kesejahteraan Rakyat";Bisnis Tempo;9/12/2023;https://bisnis.tempo.co/read/1807228/pengamat-berharap-anies-prabowo-dan-ganjar-arahkan-isu-ikn-ke-persoalan-kesejahteraan-rakyat;netral;harap anies prabowo ganjar arah isu sejahtera rakyat
Aktivis 98 Sebut Prabowo Bukan Dalang Tragedi Trisakti 98;Rakyat Merdeka;9/12/2023;https://rm.id/baca-berita/nasional/201019/aktivis-98-sebut-prabowo-bukan-dalang-tragedi-trisakti-98;negatif;aktivis prabowo dalang tragedi trisakti
"Kesal Disebut Anak Ingusan, Hasjim Bandingkan Gibran dengan Jenderal 
Sudirman";Jatim;9/12/2023;https://jatim.viva.co.id/kabar/9298-kesal-disebut-anak-ingusan-hasjim-bandingkan-gibran-dengan-jenderal-sudirman;negatif;kesal ingus hasjim banding gibran jenderal sudirman
"Prabowo Subianto Bertemu dengan Bayi Viral Kenneth ‘Kenkulus’ Matthew: 
Semoga Bisa Menjadi Anak Berprestasi - Kilat";Kilat;9/12/2023;https://www.kilat.com/nasional/84411141534/prabowo-subianto-bertemu-dengan-bayi-viral-kenneth-kenkulus-matthew-semoga-bisa-menjadi-anak-berprestasi;netral;prabowo subianto bayi viral kenneth kenkulus matthew moga prestasi kilat
"Sederet Kontroversi Gibran Asam Sulfat Hingga Bagi Susu Gratis - 
Kompasiana.com";Kompasiana.com;9/12/2023;https://www.kompasiana.com/makmalfahrezi/657472e4de948f24431e3aa3/sederet-kontroversi-gibran-asam-sulfat-hingga-bagi-susu-gratis;netral;deret kontroversi gibran asam sulfat susu gratis kompasiana com
"Menggelikan! Roy Suryo Kian Sindir Lulusan Gibran Rakabuming, Bandingkan 
Nama Universitas sang Cawapres dengan Brand Produk Pria Ini - Kilat";Kilat;9/12/2023;https://www.kilat.com/nasional/84411145456/menggelikan-roy-suryo-kian-sindir-lulusan-gibran-rakabuming-bandingkan-nama-universitas-sang-cawapres-dengan-brand-produk-pria-ini;negatif;geli roy suryo sindir lulus gibran rakabuming banding nama universitas cawapres brand produk pria kilat
"Endipat Wijaya Silaturahmi dan Senam Bareng Tim Juang Prabowo-Gibran 
Sagulung";Own Talk;9/12/2023;https://owntalk.co.id/2023/12/10/endipat-wijaya-silaturahmi-dan-senam-bareng-tim-juang-prabowo-gibran-sagulung/;netral;endipat wijaya silaturahmi senam bareng tim juang prabowo gibran sagulung
"Prabowo-Gibran Silaturahmi ke Ulama Kharismatik Pandeglang, Abuya Muhtadi 
Tegas Tetap Dukung Ganjar-Mahfud";suara banten;9/12/2023;https://banten.suara.com/read/2023/12/10/134501/prabowo-gibran-silaturahmi-ke-ulama-kharismatik-pandeglang-abuya-muhtadi-tegas-tetap-dukung-ganjar-mahfud;netral;prabowo gibran silaturahmi ulama kharismatik pandeglang abuya muhtadi dukung ganjar mahfud
Bazar Sembako Murah Prabowo-Gibran di Lumajang Ludes ...;d-onenews.com;9/12/2023;https://d-onenews.com/bazar-sembako-murah-prabowo-gibran-di-lumajang-ludes-diserbu-warga/;negatif;bazar sembilan bahan pokok murah prabowo gibran lumajang ludes
"Kader Gerindra Banyuwangi Gaspol Menangkan Prabowo-Gibran di Pilpres 2024, 
Mbah Guru Rifai Buka Posko Pemenangan 24 Jam - Adatah";Adatah;9/12/2023;https://www.adatah.com/politik/24411145440/kader-gerindra-banyuwangi-gaspol-menangkan-prabowo-gibran-di-pilpres-2024-mbah-guru-rifai-buka-posko-pemenangan-24-jam;netral;kader gerindra banyuwangi gaspol menang prabowo gibran pilpres guru rifai posko menang jam adatah
"Jelang Debat Pilpres 2023, Prabowo - Gibran Janjikan Anak Petani Hingga 
Guru Dapat Jaminan Beasiswa Hingga S3 - Innalar";Innalar;9/12/2023;https://www.innalar.com/nasional/36711143089/jelang-debat-pilpres-2023-prabowo-gibran-janjikan-anak-petani-hingga-guru-dapat-jaminan-beasiswa-hingga-s3;netral;jelang debat pilpres prabowo gibran janji tani guru jamin beasiswa innalar
"Gibran Rakabuming Raka: Anak Presiden, Pengusaha Gagal, dan Calon Wakil 
Presiden 2024";Zona Surabaya Raya;9/12/2023;https://zonasurabayaraya.pikiran-rakyat.com/nasional/pr-1857456591/gibran-rakabuming-raka-anak-presiden-pengusaha-gagal-dan-calon-wakil-presiden-2024;netral;gibran rakabuming presiden usaha gagal calon presiden
Tim Kampanye Prabowo-Gibran Sasar Pemilih Milenial;Kompas.id;10/12/2023;https://www.kompas.id/baca/nusantara/2023/12/10/tim-kampanye-prabowo-gibran-sasar-pemilih-milenial-untuk-menang-satu-putaran-di-jatim;netral;tim kampanye prabowo gibran sasar pilih milenial
Dua Mantan Gubernur Jatim Hadiri Konsolidasi Akbar TKD Prabowo-Gibran;detikcom;10/12/2023;https://www.detik.com/jatim/berita/d-7081838/dua-mantan-gubernur-jatim-hadiri-konsolidasi-akbar-tkd-prabowo-gibran;netral;gubernur jatim hadir konsolidasi akbar tkd prabowo gibran
Prabowo-Gibran 39,3% di Survei Litbang Kompas, Sarmuji: Menang 1 Putaran!;detikNews;10/12/2023;https://news.detik.com/pemilu/d-7083225/prabowo-gibran-39-3-di-survei-litbang-kompas-sarmuji-menang-1-putaran;netral;prabowo gibran survei teliti dan kembang kompas sarmuji menang putar
Kompak Berkemeja Biru, Prabowo-Gibran Hadiri Konsolidasi Pendukung di Bogor;detikNews;10/12/2023;https://news.detik.com/pemilu/d-7081934/kompak-berkemeja-biru-prabowo-gibran-hadiri-konsolidasi-pendukung-di-bogor;netral;kompak kemeja biru prabowo gibran hadir konsolidasi dukung bogor
Pujian Prabowo ke Gibran dan Proyeksi yang Lolos Pilpres Dua Putaran;Kabar24;10/12/2023;https://kabar24.bisnis.com/read/20231211/15/1722618/pujian-prabowo-ke-gibran-dan-proyeksi-yang-lolos-pilpres-dua-putaran;netral;puji prabowo gibran proyeksi lolos pilpres putar
Prabowo soal Gibran: Saya yang Minta dan Pilih Jadi Cawapres;Liputan6.com;10/12/2023;https://www.liputan6.com/news/read/5477379/prabowo-soal-gibran-saya-yang-minta-dan-pilih-jadi-cawapres;netral;prabowo gibran pilih cawapres
Indikator Politik: Prabowo-Gibran 45,8%, Menguat Dibanding ...;Databoks;10/12/2023;https://databoks.katadata.co.id/datapublish/2023/12/11/indikator-politik-prabowo-gibran-458-menguat-dibanding-paslon-lainnya;netral;indikator politik prabowo gibran kuat banding
Bela Prabowo, Gibran: Apa yang Salah dengan Joget? - Kompas.com;KOMPAS.com;10/12/2023;https://nasional.kompas.com/read/2023/12/10/20571461/bela-prabowo-gibran-apa-yang-salah-dengan-joget;negatif;prabowo gibran joget kompas com
Kode Dua Jari Khofifah Siap All Out Menangkan Prabowo-Gibran;detikcom;10/12/2023;https://www.detik.com/jatim/berita/d-7082297/kode-dua-jari-khofifah-siap-all-out-menangkan-prabowo-gibran;netral;kode jari khofifah all out menang prabowo gibran
Yusril Jadi Kuasa Hukum Prabowo-Gibran Hadapi Gugatan di PN Jakpus;CNN Indonesia;10/12/2023;https://www.cnnindonesia.com/nasional/20231210213919-12-1035407/yusril-jadi-kuasa-hukum-prabowo-gibran-hadapi-gugatan-di-pn-jakpus;netral;yusril kuasa hukum prabowo gibran gugat jakpus
Prabowo-Gibran Siap Hadapi Debat Pertama Pilpres 2024;detikNews;10/12/2023;https://news.detik.com/pemilu/d-7082421/prabowo-gibran-siap-hadapi-debat-pertama-pilpres-2024;netral;prabowo gibran debat pilpres
Diaspora muda RI deklarasi di Menara Eiffel dukung Prabowo-Gibran;Antaranews.com;10/12/2023;https://www.antaranews.com/berita/3865287/diaspora-muda-ri-deklarasi-di-menara-eiffel-dukung-prabowo-gibran;netral;diaspora muda deklarasi menara eiffel dukung prabowo gibran
Prabowo-Gibran dapat dukungan dari warga Tegal di Jabodetabek;ANTARA News;10/12/2023;https://www.antaranews.com/berita/3864591/prabowo-gibran-dapat-dukungan-dari-warga-tegal-di-jabodetabek;netral;prabowo gibran dukung tegal jabodetabek
Aktivis Gerak 98 Buya Azwar Furgudyama Tak Rela Indonesia ...;Politik;10/12/2023;https://politik.rmol.id/read/2023/12/10/600757/aktivis-gerak-98-buya-azwar-furgudyama-tak-rela-indonesia-dipimpin-prabowo-gibran;netral;aktivis gerak buya azwar furgudyama rela indonesia
Ribuan Milenial dan Gen-Z Jogja Berkumpul Beri Dukungan ...;Jogjapolitan;10/12/2023;https://jogjapolitan.harianjogja.com/read/2023/12/10/510/1157775/ribuan-milenial-dan-gen-z-jogja-berkumpul-beri-dukungan-prabowo-gibran;netral;milenial z jogja kumpul dukung
"H-1 Debat Perdana Pilpres, Prabowo ""Ngantor"" sebagai Menhan, Gibran 
Blusukan di Jakarta - Kompas.com";KOMPAS.com;10/12/2023;https://nasional.kompas.com/read/2023/12/11/09442521/h-1-debat-perdana-pilpres-prabowo-ngantor-sebagai-menhan-gibran-blusukan-di;netral;debat perdana pilpres prabowo ngantor menhan gibran blusukan jakarta kompas com
"Selain Makan Siang dan Susu Gratis, Prabowo-Gibran juga Bakal Siapkan 
Hilirisasi Digital";Viva;10/12/2023;https://www.viva.co.id/berita/politik/1666261-selain-makan-siang-dan-susu-gratis-prabowo-gibran-juga-bakal-siapkan-hilirisasi-digital;netral;siang susu gratis prabowo gibran hilir digital
TKN Prabowo-Gibran Buka Pintu untuk Eks KSAD Dudung Abdurachman;detikNews;10/12/2023;https://news.detik.com/pemilu/d-7082445/tkn-prabowo-gibran-buka-pintu-untuk-eks-ksad-dudung-abdurachman;netral;tkn prabowo gibran pintu eks ksad dudung abdurachman
Survei Indikator: 45,4 Persen Responden NU Pilih Pasangan Prabowo-Gibran;Liputan6.com;10/12/2023;https://www.liputan6.com/surabaya/read/5476991/survei-indikator-454-persen-responden-nu-pilih-pasangan-prabowo-gibran;netral;survei indikator responden pilih pasang prabowo gibran
KAMI Gibran DKI komitmen menangkan Prabowo-Gibran pada Pilpres 2024;Antaranews.com;10/12/2023;https://www.antaranews.com/berita/3864759/kami-gibran-dki-komitmen-menangkan-prabowo-gibran-pada-pilpres-2024;netral;gibran dki komitmen menang prabowo gibran pilpres
TKN Prabowo-Gibran Gelar Sabtu Biru Langit Bersama Ibu ...;Gatra;10/12/2023;https://www.gatra.com/news-587520-politik-tkn-prabowo-gibran-gelar-sabtu-biru-langit-bersama-ibu-ibu.html;netral;tkn prabowo gibran gelar biru langit
Basis Massa Kuat, Prabowo-Gibran Diprediksi Tetap Merajai di Jabar;Tribun Jabar;10/12/2023;https://jabar.tribunnews.com/2023/12/10/basis-massa-kuat-prabowo-gibran-diprediksi-tetap-merajai-di-jabar;netral;basis massa kuat prabowo gibran prediksi raja jabar
"TKN Prabowo-Gibran Paparkan Kesuksesan Makan Siang Gratis untuk Siswa di 
India dan Sudan";Viva;10/12/2023;https://www.viva.co.id/berita/politik/1666478-tkn-prabowo-gibran-paparkan-kesuksesan-makan-siang-gratis-untuk-siswa-di-india-dan-sudan;netral;tkn prabowo gibran sukses siang gratis siswa india sudan
Jayabaya Dukung Prabowo-Gibran, Elit PDIP Lebak Beri ...;Radar Banten;10/12/2023;https://www.radarbanten.co.id/2023/12/11/jayabaya-dukung-prabowo-gibran-elit-pdip-lebak-beri-tanggapan-begini/;netral;jayabaya dukung prabowo gibran elit pdip lebak
Bantu Kesehatan Masyarakat, Relawan Prabowo-Gibran ...;Politik;10/12/2023;https://politik.rmol.id/read/2023/12/10/600761/bantu-kesehatan-masyarakat-relawan-prabowo-gibran-rbui-luncurkan-mobil-rumah-sehat-keliling;netral;sehat masyarakat rawan prabowo gibran
Prabowo-Gibran Akan Sempurnakan UU Pemberantasan Korupsi;BeritaSatu.com;10/12/2023;https://www.beritasatu.com/bersatu-kawal-pemilu/2786175/prabowo-gibran-akan-sempurnakan-uu-pemberantasan-korupsi;netral;prabowo gibran sempurna uu berantas korupsi
Survei Terbaru Litbang Kompas: Elektabilitas Prabowo-Gibran ...;Merdeka.com;10/12/2023;https://www.merdeka.com/politik/survei-terbaru-litbang-kompas-elektabilitas-prabowo-gibran-teratas-393-ganjar-mahfud-anjlok-153-60294-mvk.html;netral;survei teliti dan kembang kompas elektabilitas prabowo gibran
Hadiri Konsolidasi Prabowo-Gibran di Sentul, AHY Jamin ...;Merdeka.com;10/12/2023;https://www.merdeka.com/politik/hadiri-konsolidasi-prabowo-gibran-di-sentul-ahy-jamin-mesin-partai-demokrat-bekerja-60198-mvk.html;netral;hadir konsolidasi prabowo gibran sentul ahy jamin
Gibran Siap Dampingi Prabowo di Panggung Debat Perdana ...;Politik;10/12/2023;https://politik.rmol.id/read/2023/12/11/600836/gibran-siap-dampingi-prabowo-di-panggung-debat-perdana-capres-2024-;netral;gibran damping prabowo panggung debat perdana
"Survei Indikator: Prabowo-Gibran Menguat di Suara Warga NU dan Muhammadiyah 
- harian.disway.id";Harian Disway;10/12/2023;https://harian.disway.id/read/748633/survei-indikator-prabowo-gibran-menguat-di-suara-warga-nu-dan-muhammadiyah;netral;survei indikator prabowo gibran kuat suara muhammadiyah disway
Dana Awal Kampanye: Anies-Muhaimin Rp1 Miliar, Prabowo ...;Pemilu 2024;10/12/2023;https://pemilu2024.harianjogja.com/read/2023/12/11/643/1157823/dana-awal-kampanye-anies-muhaimin-rp1-miliar-prabowo-gibran-rp314-miliar-ganjar-mahfud-rp29-miliar;netral;dana kampanye anies muhaimin rp miliar prabowo
Si Monang PAPERA Kabupaten Semarang Nobar Waktunya ...;Suara Pantau;10/12/2023;https://suarapantau.com/2023/12/10/si-monang-papera-kabupaten-semarang-nobar-waktunya-indonesia-maju-prabowo-gibran/;netral;monang papera kabupaten sarang nonton bareng
Prabowo-Gibran Hadiri Konsolidasi Waktunya Indonesia Maju ...;20detik;10/12/2023;https://20.detik.com/detikupdate/20231210-231210086/prabowo-gibran-hadiri-konsolidasi-waktunya-indonesia-maju-di-bogor;netral;prabowo gibran hadir konsolidasi indonesia maju
"Janji Prabowo-Gibran Bangun 150.000 Rumah di Desa, Kebutuhan Nasional 12,7 
Juta - kumparan.com";kumparan;10/12/2023;https://kumparan.com/kumparanbisnis/janji-prabowo-gibran-bangun-150-000-rumah-di-desa-kebutuhan-nasional-12-7-juta-21kMlCOcZCE;netral;janji prabowo gibran bangun rumah desa butuh nasional juta kumpar com
Gus Miftah dan Bupati Kendal Kampanyekan Prabowo ...;RMOL JATENG;10/12/2023;https://www.rmoljawatengah.id/gus-miftah-dan-bupati-kendal-kampanyekan-prabowo-gibran-di-demak;netral;miftah bupati kendal kampanye prabowo
TKN Prabowo-Gibran: Pindah Ibu Kota adalah Keharusan;KOMPAS.com;10/12/2023;https://video.kompas.com/watch/1087045/tkn-prabowo-gibran-pindah-ibu-kota-adalah-keharusan;netral;tkn prabowo gibran pindah kota
"Bincang Keumatan, Anis Matta Berharap Dukungan Tokoh Jatim untuk Gelora dan 
Prabowo-Gibran";Liputan6.com;10/12/2023;https://www.liputan6.com/surabaya/read/5477375/bincang-keumatan-anis-matta-berharap-dukungan-tokoh-jatim-untuk-gelora-dan-prabowo-gibran;netral;bincang umat anis matta harap dukung tokoh jatim gelora prabowo gibran
Sosialisasikan Prabowo Gibran, DPC Gerindra Kota Kediri ...;Harian Bhirawa;10/12/2023;https://www.harianbhirawa.co.id/sosialisasikan-prabowo-gibran-dpc-gerindra-kota-kediri-gelar-senam-bersama/;netral;sosialisasi prabowo gibran dpc gerindra kota
"Kaesang Pangarep Yakin Prabowo-Gibran Bakal Menang Satu Putaran, Ketum PSI: 
Survei Udah Bagus! - Kilat";Kilat;10/12/2023;https://www.kilat.com/pemilu-2024/84411150744/kaesang-pangarep-yakin-prabowo-gibran-bakal-menang-satu-putaran-ketum-psi-survei-udah-bagus;netral;kaesang pangarep prabowo gibran menang putar tum psi survei bagus kilat
"[TOP 3 NEWS] Konsolidasi Pemenangan Prabowo-Gibran, 4 Jenazah Anak 
Jagakarsa Dimakamkan";KOMPAS.tv;10/12/2023;https://www.kompas.tv/video/467936/top-3-news-konsolidasi-pemenangan-prabowo-gibran-4-jenazah-anak-jagakarsa-dimakamkan;netral;top news konsolidasi menang prabowo gibran jenazah jagakarsa makam
"Mengurai Visi Ekonomi Biru Prabowo-Gibran Menuju Kesejahteraan - 
Kompasiana.com";Kompasiana.com;10/12/2023;https://www.kompasiana.com/rahman51536/6576b179c57afb79f95fa2f2/mengurai-visi-ekonomi-biru-prabowo-gibran-menuju-kesejahteraan;netral;urai visi ekonomi biru prabowo gibran sejahtera kompasiana com
Pengamat: Sebaiknya Prabowo-Gibran Lebih Banyak ...;Kedai Pena;10/12/2023;https://www.kedaipena.com/pengamat-sebaiknya-prabowo-gibran-lebih-banyak-melibatkan-para-pakar/;netral;prabowo gibran
Janji Rangkul Rakyat, Prabowo: Sebelum Yang Maha Kuasa ...;Politik;10/12/2023;https://politik.rmol.id/read/2023/12/10/600772/janji-rangkul-rakyat,-prabowo:-sebelum-yang-maha-kuasa-memanggil,-saya-ingin-berbakti-;netral;janji rangkul rakyat prabowo maha kuasa
Repnas Kalsel Deklarasi Dukungan, Prabowo-Gibran ...;Ipol.id;10/12/2023;https://ipol.id/2023/12/repnas-kalsel-deklarasi-dukungan-prabowo-gibran-menang-1-putaran/;netral;repnas kalsel deklarasi dukung prabowo gibran
Prabowo Gibran Hadiri Konsolidasi Waktunya Indonesia Maju;Tribunnews.com;10/12/2023;https://www.tribunnews.com/images/editorial/view/1985765/prabowo-gibran-hadiri-konsolidasi-waktunya-indonesia-maju;positif;prabowo gibran hadir konsolidasi indonesia maju
TKD Prabowo-Gibran Lampung Serahkan Bantuan Rp250 ...;RILIS ID - Lampung;10/12/2023;https://lampung.rilis.id/Politika/Berita/TKD-PrabowoGibran-Lampung-Serahkan-Bantuan-Rp250-Juta-Langsung-kepada-Dubes-Palestina-7u7flOM;netral;tkd prabowo gibran lampung serah rp
Projo Yakin Prabowo-Gibran Menang Satu Putaran, Timnas Amin: Realistis Saja;Tribunnews.com;10/12/2023;https://www.tribunnews.com/mata-lokal-memilih/2023/12/10/projo-yakin-prabowo-gibran-menang-satu-putaran-timnas-amin-realistis-saja;netral;projo prabowo gibran menang putar timnas amin realistis
"Ngebet Adu Ide, TPN Ganjar-Mahfud Sayangkan Prabowo-Gibran Malah Tonjolkan 
Joget";JPNN.com;10/12/2023;https://www.jpnn.com/news/ngebet-adu-ide-tpn-ganjar-mahfud-sayangkan-prabowo-gibran-malah-tonjolkan-joget;netral;ngebet ide tpn ganjar mahfud sayang prabowo gibran tonjol joget
Dukung Prabowo-Gibran, Warga Tegal di Jabodetabek Harap ...;20detik;10/12/2023;https://20.detik.com/detikupdate/20231210-231210076/dukung-prabowo-gibran-warga-tegal-di-jabodetabek-harap-warteg-tak-digusur;netral;dukung prabowo gibran tegal jabodetabek harap
"Dewan Penasihat TKN Prabowo-Gibran TGKH Atsani Gaet Suara Milenial Melalui 
Relawan Rindu";Tribun Lombok;10/12/2023;https://lombok.tribunnews.com/2023/12/10/dewan-penasihat-tkn-prabowo-gibran-tgkh-atsani-gaet-suara-milenial-melalui-relawan-rindu;netral;dewan nasihat tkn prabowo gibran tgkh atsani gaet suara milenial rawan rindu
