judul_berita;portal_media;tanngal_publikasi;url;hasil_sentimen;olahan_teks
"Emil Dardak: Jangan Lihat Usia, Gibran Sosok Paling Kompeten Bangun 
Perekonomian Indonesia";Liputan6.com;4/12/2023;https://www.liputan6.com/surabaya/read/5471511/emil-dardak-jangan-lihat-usia-gibran-sosok-paling-kompeten-bangun-perekonomian-indonesia;netral;emil dardak usia gibran sosok kompeten bangun ekonomi indonesia
Jika Prabowo-Gibran Menang Pilpres 2024, GBM: Hasil ...;Suara Nasional;4/12/2023;https://suaranasional.com/2023/12/04/jika-prabowo-gibran-menang-pilpres-2024-gbm-hasil-kecurangan/;netral;prabowo gibran menang pilpres gbm hasil
AHY Pede Prabowo-Gibran Menang Satu Putaran, Ini Bocorannya;Informasi dan Berita Hari Ini;4/12/2023;https://siap.viva.co.id/news/2626-ahy-pede-prabowo-gibran-menang-satu-putaran-ini-bocorannya;negatif;ahy percaya diri prabowo gibran menang putar bocor
Kader Partai Gerindra Sidoarjo, Menangkan Pasangan ...;Radar Bangsa;4/12/2023;https://radarbangsa.co.id/semangat-kader-partai-gerindra-sidoarjo-menangkan-pasangan-prabowo-gibran/;netral;kader partai gerindra sidoarjo menang pasang
Siapa Unru Baso? Ditunjuk Jabat Ketua TKD Prabowo - Gibran di Luwu;Tribun makassar;4/12/2023;https://makassar.tribunnews.com/2023/12/04/siapa-unru-baso-ditunjuk-jabat-ketua-tkd-prabowo-gibran-di-luwu;netral;unru baso jabat ketua tkd prabowo gibran luwu
Polres Lampung Tengah Amankan Kampanye Tim Prabowo Gibran;realita lampung;4/12/2023;https://realitalampung.com/2023/12/04/polres-lampung-tengah-amankan-kampanye-tim-prabowo-gibran/;netral;polres lampung kampanye tim prabowo gibran
Sederet Blunder yang Diciptakan Gibran saat Kampanye;Kabar24;4/12/2023;https://kabar24.bisnis.com/read/20231204/15/1720841/sederet-blunder-yang-diciptakan-gibran-saat-kampanye;netral;deret blunder cipta gibran kampanye
"Gaspoll Bro!' Prabowo-Gibran Terpasang di Bekasi Jadi Perhatian Warga - 
Bekasi Kinian";Bekasikinian.com;4/12/2023;https://www.bekasikinian.com/kota-bekasi/33811088096/gaspoll-bro-prabowo-gibran-terpasang-di-bekasi-jadi-perhatian-warga;positif;gaspoll saudara laki prabowo gibran pasang bekas perhati bekas
"Kantor PAC PDIP di Sukabumi Dicoret-coret, Ada tulisan It's Prabowo Gibran' 
- kumparan.com";kumparan;4/12/2023;https://kumparan.com/kumparannews/kantor-pac-pdip-di-sukabumi-dicoret-coret-ada-tulisan-its-prabowo-gibran-21hhCZvUK3Q;netral;kantor pac pdip sukabumi coret coret tulis prabowo gibran kumpar com
Demi Menangkan Prabowo Jadi Presiden, Gerindra ...;Rakyat Merdeka;4/12/2023;https://rm.id/baca-berita/pemilu/200200/demi-menangkan-prabowo-jadi-presiden-gerindra-utamakan-pilpres;netral;menang prabowo presiden gerindra
Gibran Jadi Cawapres Prabowo, Bambang Pacul: Don’t Worry, PDIP Jateng Solid;Soloraya;4/12/2023;https://soloraya.solopos.com/gibran-jadi-cawapres-prabowo-bambang-pacul-dont-worry-pdip-jateng-solid-1812086;netral;gibran cawapres prabowo bambang pacul worry pdip jateng solid
Berkunjung ke Banten, Prabowo Dianggap Peduli ...;Radar Banten;4/12/2023;https://www.radarbanten.co.id/2023/12/04/berkunjung-ke-banten-prabowo-dianggap-peduli-pembangunan-di-banten/;netral;kunjung banten prabowo anggap peduli
"Prabowo-Gibran Kampanyekan Pembangunan Bandara Bali Utara, PDIP Sebut Jalan 
TOL Lebih Prioritas";Tribun-bali.com;4/12/2023;https://bali.tribunnews.com/2023/12/04/prabowo-gibran-kampanyekan-pembangunan-bandara-bali-utara-pdip-sebut-jalan-tol-lebih-prioritas;netral;prabowo gibran kampanye bangun bandara utara pdip prioritas
"6 Hasil Survei Terbaru Capres-Cawapres, Prabowo-Gibran Berpeluang Menang 1 
Putaran Versi 3 Lembaga";Tribun Wow;4/12/2023;https://wow.tribunnews.com/2023/12/04/6-hasil-survei-terbaru-capres-cawapres-prabowo-gibran-berpeluang-menang-1-putaran-versi-3-lembaga;netral;hasil survei capres cawapres prabowo gibran peluang menang putar versi lembaga
"[FULL] Pengamat: Gibran Beban Berat Prabowo di Debat, Dia Ini Turunkan 
Level Pilpres kayak Pilkades";Tribun Video;4/12/2023;https://video.tribunnews.com/view/678994/full-pengamat-gibran-beban-berat-prabowo-di-debat-dia-ini-turunkan-level-pilpres-kayak-pilkades;netral;full gibran beban prabowo debat turun level pilpres kayak pilkades
Wagub Kepri Dukung Prabowo - Metropolis;Batam Pos;4/12/2023;https://metro.batampos.co.id/wagub-kepri-dukung-prabowo/;netral;wagub kepri dukung prabowo metropolis
"Hasil Survei Internal PDIP, Elektabilitas Prabowo-Gibran Teratas, Ungguli 
Ganjar-Mahfud";Tribun Wow;4/12/2023;https://wow.tribunnews.com/2023/12/04/hasil-survei-internal-pdip-elektabilitas-prabowo-gibran-teratas-ungguli-ganjar-mahfud;netral;hasil survei internal pdip elektabilitas prabowo gibran unggul ganjar mahfud
Kampanye Pilpres 2024, Prabowo - Gibran Bakal Turun ke Sulawesi Utara;Tribun Manado;4/12/2023;https://manado.tribunnews.com/2023/12/04/kampanye-pilpres-2024-prabowo-gibran-bakal-turun-ke-sulawesi-utara;netral;kampanye pilpres prabowo gibran turun sulawesi utara
Prabowo: Kita Akan Punya Mobil Buatan Indonesia;Liputan6.com;4/12/2023;https://www.liputan6.com/bisnis/read/5472054/prabowo-kita-akan-punya-mobil-buatan-indonesia;netral;prabowo mobil indonesia
Relawan Emak2 dan Perempuan Optimis Prabowo Subianto ...;kupas merdeka;4/12/2023;https://www.kupasmerdeka.com/2023/12/relawan-emak2-dan-perempuan-optimis-prabowo-subianto-mampu-bangkitkan-ekonomi/;netral;rawan perempuan optimis prabowo subianto
"Golkar Sulsel Angkat Bicara Soal Kadernya-Ipar SYL Dukung Anies-Imin 
Padahal Partainya Dukung Prabowo-Gibran";Herald Sulsel;4/12/2023;https://sulsel.herald.id/2023/12/04/golkar-sulsel-angkat-bicara-soal-kadernya-ipar-syl-dukung-anies-imin-padahal-partainya-dukung-prabowo-gibran/;netral;golkar sulsel angkat bicara kader ipar syl dukung anies partai dukung prabowo gibran
TKN: Prabowo-Gibran akan Jamin Hak-Hak Warga Negara ...;Gelora News;4/12/2023;https://www.gelora.co/2023/12/tkn-prabowo-gibran-akan-jamin-hak-hak.html;netral;tkn prabowo gibran jamin negara
"Manfaat Asam Folat Bagi Ibu Hamil yang Sempat Keliru Disebut Gibran - 
kumparan.com";kumparan;4/12/2023;https://kumparan.com/kumparansains/manfaat-asam-folat-bagi-ibu-hamil-yang-sempat-keliru-disebut-gibran-21i0jxfSl5E;netral;manfaat asam folat hamil keliru gibran kumpar com
TKN Prabowo Detailkan Program Makan Siang Gratis, Capai 82,9 Juta Penerima;Portal Media;4/12/2023;https://portalmedia.id/read/12004/tkn-prabowo-detailkan-program-makan-siang-gratis-capai-829-juta-penerima;netral;tkn prabowo detail program siang gratis capai juta terima
"Jadwal Kampanye Capres-Cawapres Hari Ini, Anies ke Karawang, Prabowo 
Ngantor, Ganjar di Palu";KOMPAS.tv;4/12/2023;https://www.kompas.tv/nasional/466202/jadwal-kampanye-capres-cawapres-hari-ini-anies-ke-karawang-prabowo-ngantor-ganjar-di-palu?page=all;netral;jadwal kampanye capres cawapres anies karawang prabowo ngantor ganjar palu
Refreshing, Gibran Main Bulutangkis di GBK Arena;Politik;4/12/2023;https://politik.rmol.id/read/2023/12/04/600010/refreshing-gibran-main-bulutangkis-di-gbk-arena;netral;refreshing gibran main bulutangkis gbk
Golkar Sulsel Tak Wajibkan Caleg Pasang Muka Prabowo-Gibran di Baliho;Herald Sulsel;4/12/2023;https://sulsel.herald.id/2023/12/04/golkar-sulsel-tak-wajibkan-caleg-pasang-muka-prabowo-gibran-di-baliho/;netral;golkar sulsel wajib caleg pasang prabowo gibran baliho
Prabowo Ingin Alihkan Dana Kesehatan untuk Makan Siang ...;Herald.id;4/12/2023;https://herald.id/2023/12/04/prabowo-ingin-alihkan-dana-kesehatan-untuk-makan-siang-gratis-dokter-ahli-jantung-mundur-dari-demokrat/;netral;prabowo alih dana sehat siang
"Video Momen Gibran Ditanya Ibu-ibu soal Cara Stabilkan Harga saat Blusukan, 
Jawaban Cawapres Prabowo";Tribun Kaltim;4/12/2023;https://kaltim.tribunnews.com/2023/12/04/video-momen-gibran-ditanya-ibu-ibu-soal-cara-stabilkan-harga-saat-blusukan-jawaban-cawapres-prabowo;netral;video momen gibran stabil harga blusukan cawapres prabowo
Di Malang, Kaesang Ungkap Rahasia Kenapa Gibran ...;Malang Raya;4/12/2023;https://malangraya.blok-a.com/politik/di-malang-kaesang-ungkap-rahasia-kenapa-gibran-dipasangkan-di-prabowo-di-pilpres-2024-ada-peran-jokowi/;netral;malang kaesang rahasia gibran
"Prabowo Berikan Penghormatan Terakhir ke Doni Monardo, Gibran Kampanye Bagi 
Susu dan Buku Gratis";KOMPAS.tv;4/12/2023;https://www.kompas.tv/video/466432/prabowo-berikan-penghormatan-terakhir-ke-doni-monardo-gibran-kampanye-bagi-susu-dan-buku-gratis;netral;prabowo hormat doni monardo gibran kampanye susu buku gratis
Hasil Poling VIVA, Anies-Imin Tertinggi Jauh Tinggalkan ...;Gelora News;4/12/2023;https://www.gelora.co/2023/12/hasil-poling-viva-anies-imin-tertinggi.html;netral;hasil poling viva anies
Fahri Hamzah Kritik Paslon Peserta Pilpres 2024 Pengusung ...;SinPo.id;4/12/2023;https://sinpo.id/detail/63365/fahri-hamzah-kritik-paslon-peserta-pilpres-2024-pengusung-jargon-perubahan;netral;fahri hamzah kritik paslon pilpres usung
Gibran Tanda Tangani Piagam Deklarasi Dukungan Sedulur ...;Cumicumi.com;4/12/2023;https://m.cumicumi.com/articles/hot-news/656d39b7920ccc758a0351a2/gibran-tanda-tangani-piagam-deklarasi-dukungan-sedulur-jokowi;netral;gibran tangan piagam deklarasi dukung dulur
"Bisnisnya Banyak yang Tutup, Gibran Diragukan Sanggup Benahi Ekonomi 
Nasional - Harian Terbit";Harian Terbit;4/12/2023;https://www.harianterbit.com/nasional/27411090325/bisnisnya-banyak-yang-tutup-gibran-diragukan-sanggup-benahi-ekonomi-nasional;netral;bisnis tutup gibran ragu sanggup benah ekonomi nasional terbit
Ini Daftar 10 SMA Terbaik di Jakarta, Bisa Jadi Referensi PPDB 2024;Tekno Tempo.co;4/12/2023;https://tekno.tempo.co/read/1804898/ini-daftar-10-sma-terbaik-di-jakarta-bisa-jadi-referensi-ppdb-2024;netral;daftar jakarta referensi ppdb
"Gibran Rakabuming Ajak Istri Makan di Warung Kaki Lima Rojo Sambel, Raffi: 
Makasih Sudah Mampir";Tribun Video;4/12/2023;https://video.tribunnews.com/view/678989/gibran-rakabuming-ajak-istri-makan-di-warung-kaki-lima-rojo-sambel-raffi-makasih-sudah-mampir;netral;gibran rakabuming ajak istri warung kaki rojo sambel raffi terima kasih mampir
KDM : Banyak Kisah Unik saat Sosialisasikan Prabowo-Gibran Keliling Jabar;Desk Jabar;4/12/2023;https://deskjabar.pikiran-rakyat.com/jabar/pr-1137433877/kdm-banyak-kisah-unik-saat-sosialisasikan-prabowo-gibran-keliling-jabar;netral;kdm kisah unik sosialisasi prabowo gibran keliling jabar
TKN Prabowo-Gibran Tabuh Genderang Perang terhadap ...;Pantau;4/12/2023;https://www.pantau.com/ekonomi/188558/tkn-prabowo-gibran-tabuh-genderang-perang-terhadap-oligarki-melalui-pajak;netral;tkn prabowo gibran tabuh genderang perang
Dewan Pakar TKN Prabowo-Gibran klarifikasi soal “asam sulfat”;Antaranews.com;5/12/2023;https://www.antaranews.com/berita/3857283/dewan-pakar-tkn-prabowo-gibran-klarifikasi-soal-asam-sulfat;netral;dewan pakar tkn prabowo gibran klarifikasi asam sulfat
"Dewan Pakar TKN Prabowo Gibran Jelaskan Manfaat Bantuan Gizi untuk Ibu 
Hamil dan Balita";Viva;5/12/2023;https://www.viva.co.id/berita/politik/1664627-dewan-pakar-tkn-prabowo-gibran-jelaskan-manfaat-bantuan-gizi-untuk-ibu-hamil-dan-balita;netral;dewan pakar tkn prabowo gibran manfaat gizi hamil balita
"Dewan Pakar TKN Sebut Asam Folat dan Vitamin D Masuk Program Bantuan Gizi 
Gratis Prabowo-Gibran";Warta Kota;5/12/2023;https://wartakota.tribunnews.com/2023/12/05/dewan-pakar-tkn-sebut-asam-folat-dan-vitamin-d-masuk-program-bantuan-gizi-gratis-prabowo-gibran;netral;dewan pakar tkn asam folat vitamin program gizi gratis prabowo gibran
Pengamat kritik gaya kampanye Prabowo-Gibran yang terlalu percaya diri;Antaranews.com;5/12/2023;https://www.antaranews.com/berita/3856974/pengamat-kritik-gaya-kampanye-prabowo-gibran-yang-terlalu-percaya-diri;netral;kritik gaya kampanye prabowo gibran percaya
"TKN Prabowo-Gibran: 82,9 Juta Warga Baru Dapat Makan Siang-Susu Gratis pada 
2029 - Kompas.com";KOMPAS.com;5/12/2023;https://nasional.kompas.com/read/2023/12/05/16481871/tkn-prabowo-gibran-829-juta-warga-baru-dapat-makan-siang-susu-gratis-pada;netral;tkn prabowo gibran juta siang susu gratis kompas com
Gagas Program Pro Rakyat, Prabowo-Gibran Rebut Hati Masyarakat Indonesia;Tribun Jabar;5/12/2023;https://jabar.tribunnews.com/2023/12/05/gagas-program-pro-rakyat-prabowo-gibran-rebut-hati-masyarakat-indonesia;netral;gagas program profesional rakyat prabowo gibran rebut hati masyarakat indonesia
Yakin Menang 1 Putaran, TKD Jatim Targetkan Prabowo-Gibran Rebut 44% Suara;Detik;5/12/2023;https://www.detik.com/jatim/berita/d-7074244/yakin-menang-1-putaran-tkd-jatim-targetkan-prabowo-gibran-rebut-44-suara;netral;menang putar tkd jatim target prabowo gibran rebut suara
Tim Kampanye Prabowo-Gibran Banten Siapkan Strategi Kemenangan Pilpres;detikNews;5/12/2023;https://news.detik.com/berita/d-7074169/tim-kampanye-prabowo-gibran-banten-siapkan-strategi-kemenangan-pilpres;netral;tim kampanye prabowo gibran banten strategi menang pilpres
Hari ke-8 kampanye, Prabowo-Gibran lanjutkan tugas di pemerintahan;ANTARA News Kalimantan Selatan;5/12/2023;https://kalsel.antaranews.com/berita/397152/hari-ke-8-kampanye-prabowo-gibran-lanjutkan-tugas-di-pemerintahan;netral;kampanye prabowo gibran tugas perintah
Rahasiakan Hasil Survei, Airlangga Klaim Elektabilitas ...;Kompas.id;5/12/2023;https://www.kompas.id/baca/polhuk/2023/12/05/rahasiakan-hasil-survei-airlangga-klaim-elektabilitas-prabowo-gibran-positif;netral;rahasia hasil survei airlangga klaim elektabilitas
"Ridwan Kamil Ingin Manfaatkan Media Sosial untuk Sampaikan Gagasan 
Prabowo-Gibran - Kompas.com";KOMPAS.com;5/12/2023;https://nasional.kompas.com/read/2023/12/05/17585411/ridwan-kamil-ingin-manfaatkan-media-sosial-untuk-sampaikan-gagasan-prabowo;netral;ridwan manfaat media sosial gagas prabowo gibran kompas com
HNW Sentil Jubir TKN Prabowo-Gibran soal Perlindungan Kaum Non-Biner;detikNews;5/12/2023;https://news.detik.com/pemilu/d-7074075/hnw-sentil-jubir-tkn-prabowo-gibran-soal-perlindungan-kaum-non-biner;netral;hnw sentil juru bicara tkn prabowo gibran lindung kaum non biner
Timnas AMIN Terima Tantangan TKN Prabowo-Gibran Debat Pakai Bahasa Inggris;Kabar24;5/12/2023;https://kabar24.bisnis.com/read/20231205/15/1721212/timnas-amin-terima-tantangan-tkn-prabowo-gibran-debat-pakai-bahasa-inggris;netral;timnas amin terima tantang tkn prabowo gibran debat pakai bahasa inggris
Gandeng Dewa 19, Prabu Bidik Suara Prabowo-Gibran di Lampung;Detik.com;5/12/2023;https://www.detik.com/sumbagsel/berita/d-7072617/gandeng-dewa-19-prabu-bidik-suara-prabowo-gibran-di-lampung;netral;gandeng dewa prabu bidik suara prabowo gibran lampung
TKN: Prabowo-Gibran siap wujudkan ekonomi berkeadilan;Antaranews.com;5/12/2023;https://www.antaranews.com/berita/3856995/tkn-prabowo-gibran-siap-wujudkan-ekonomi-berkeadilan;netral;tkn prabowo gibran wujud ekonomi
"Dukungan Penuh NU Perkuat Kemenangan Prabowo-Gibran di Jawa Timur - Radar 
Jember";Radar Jember;5/12/2023;https://radarjember.jawapos.com/sinergi/793439885/dukungan-penuh-nu-perkuat-kemenangan-prabowo-gibran-di-jawa-timur;netral;dukung penuh kuat menang prabowo gibran timur radar jember
"Bawaslu Panggil 2 Kubu Apdesi Telusuri Dugaan Dukungan untuk Prabowo-Gibran 
- Kompas.com";KOMPAS.com;5/12/2023;https://nasional.kompas.com/read/2023/12/05/16304351/bawaslu-panggil-2-kubu-apdesi-telusuri-dugaan-dukungan-untuk-prabowo-gibran?page=all;netral;bawaslu panggil kubu apdesi telusur duga dukung prabowo gibran kompas com
"Baliho Gaspoll Bro Prabowo-Gibran Mantapkan Pilihan Warga Jatim di Pilpres 
2024 - Radar Kediri";Radar Kediri;5/12/2023;https://radarkediri.jawapos.com/politika/783440952/baliho-gaspoll-bro-prabowo-gibran-mantapkan-pilihan-warga-jatim-di-pilpres-2024;netral;baliho gaspoll saudara laki prabowo gibran mantap pilih jatim pilpres radar
"Raih Limpahan Suara Pemilih Jokowi, Prabowo-Gibran Makin Potensial 
Menangkan Pilpres Satu Putaran - Radar Bojonegoro";Radar Bojonegoro;5/12/2023;https://radarbojonegoro.jawapos.com/nasional/713440345/raih-limpahan-suara-pemilih-jokowi-prabowo-gibran-makin-potensial-menangkan-pilpres-satu-putaran;netral;raih limpah suara pilih jokowi prabowo gibran potensial menang pilpres putar radar bojonegoro
"Semakin Populer Ketika Diserang jadi Sebab Elektabilitas Prabowo-Gibran 
Selalu Cemerlang";Tribun Jabar;5/12/2023;https://jabar.tribunnews.com/2023/12/05/semakin-populer-ketika-diserang-jadi-sebab-elektabilitas-prabowo-gibran-selalu-cemerlang;positif;populer serang elektabilitas prabowo gibran cemerlang
Miliki Basis Kuat, Prabowo-Gibran Dinilai Mampu Raup 60 Persen Suara Jabar;Tribun Jabar;5/12/2023;https://jabar.tribunnews.com/2023/12/05/miliki-basis-kuat-prabowo-gibran-dinilai-mampu-raup-60-persen-suara-jabar;positif;basis kuat prabowo gibran nilai raup suara jabar
"Polemik Soal Debat Capres-Cawapres, TKN Sebut Prabowo-Gibran Siap Debat 
dengan Format Apapun";Bangkapos.com;5/12/2023;https://bangka.tribunnews.com/2023/12/05/polemik-soal-debat-capres-cawapres-tkn-sebut-prabowo-gibran-siap-debat-dengan-format-apapun;netral;polemik debat capres cawapres tkn prabowo gibran debat format
AHY Ungkap Alasan Prabowo-Gibran Irit Bicara Saat Kampanye Pilpres 2024;Liputan6.com;5/12/2023;https://www.liputan6.com/pemilu/read/5473285/ahy-ungkap-alasan-prabowo-gibran-irit-bicara-saat-kampanye-pilpres-2024;netral;ahy alas prabowo gibran irit bicara kampanye pilpres
"Bawaslu Telusuri Unsur Kampanye dalam Iklan Susu dengan Wajah Prabowo - 
Kompas.com";KOMPAS.com;5/12/2023;https://nasional.kompas.com/read/2023/12/05/20165451/bawaslu-telusuri-unsur-kampanye-dalam-iklan-susu-dengan-wajah-prabowo;netral;bawaslu telusur unsur kampanye dalam iklan susu wajah prabowo kompas com
"Resmikan Markas Pemenangan, Relawan Sahabat Pagi Siap Menangkan 
Prabowo-Gibran Satu Putaran";Liputan6.com;5/12/2023;https://www.liputan6.com/pemilu/read/5473235/resmikan-markas-pemenangan-relawan-sahabat-pagi-siap-menangkan-prabowo-gibran-satu-putaran;netral;resmi markas menang rawan sahabat pagi menang prabowo gibran putar
Sosialisasi Kreatif, Prabowo-Gibran Jadi Pasangan Pilihan Generasi Muda;Tribun Jabar;5/12/2023;https://jabar.tribunnews.com/2023/12/05/sosialisasi-kreatif-prabowo-gibran-jadi-pasangan-pilihan-generasi-muda;netral;sosialisasi kreatif prabowo gibran pasang pilih generasi muda
"50 Ribu Jamaah Ponpes Nurut Taqwa Bondowoso Doakan Prabowo-Gibran untuk 
Indonesia Maju";Liputan6.com;5/12/2023;https://www.liputan6.com/pemilu/read/5473254/50-ribu-jamaah-ponpes-nurut-taqwa-bondowoso-doakan-prabowo-gibran-untuk-indonesia-maju;netral;jamaah pondok pesantren taqwa bondowoso doa prabowo gibran indonesia maju
TKN Prabowo-Gibran: Jangan Cari Pemimpin Berstatus Petugas Partai - Jawa Pos;JawaPos.com;5/12/2023;https://www.jawapos.com/politik/013440448/tkn-prabowo-gibran-jangan-cari-pemimpin-berstatus-petugas-partai;netral;tkn prabowo gibran pimpin status tugas partai pos
TKN sebut Prabowo-Gibran siap bantu anak muda dapatkan ...;Antaranews.com;5/12/2023;https://www.antaranews.com/video/3857169/tkn-sebut-prabowo-gibran-siap-bantu-anak-muda-dapatkan-pekerjaan;netral;tkn prabowo gibran muda
Prabowo-Gibran Tampung Masukan Ahli dan Publik;RIAU POS;5/12/2023;https://riaupos.jawapos.com/politik/06/12/2023/317175/prabowogibran-tampung%C2%A0masukan-ahli-dan-publik.html;netral;prabowo gibran tampung ahli publik
Tim Prabowo-Gibran ke Rote dan Sabu Beri Makanan Gizi Bagi Anak;Tribun Flores;5/12/2023;https://flores.tribunnews.com/2023/12/05/tim-prabowo-gibran-ke-rote-dan-sabu-beri-makanan-gizi-bagi-anak;netral;tim prabowo gibran rote sabu gizi
"Barudak Balik Bandung Deklarasi Dukung Prabowo-Gibran dan Caleg Partai 
Gerindra Kang Tebe";Tribun Jabar;5/12/2023;https://jabar.tribunnews.com/2023/12/05/barudak-balik-bandung-deklarasi-dukung-prabowo-gibran-dan-caleg-partai-gerindra-kang-tebe;netral;barudak bandung deklarasi dukung prabowo gibran caleg partai gerindra tebe
"Tabloid Bergambar Prabowo-Gibran Beredar di Pasar Rejowinangun Kota 
Magelang, Ini Kata Pedagang";Tribun Jogja;5/12/2023;https://jogja.tribunnews.com/2023/12/05/tabloid-bergambar-prabowo-gibran-beredar-di-pasar-rejowinangun-kota-magelang-ini-kata-pedagang;netral;tabloid gambar prabowo gibran pasar rejowinangun kota magelang dagang
"Ini Jadwal Resmi Kampanye Nasional Prabowo- Gibran, Hanya Kunjungi 2 
Kabupaten di Sulsel";FAJAR;5/12/2023;https://fajar.co.id/2023/12/05/ini-jadwal-resmi-kampanye-nasional-prabowo-gibran-hanya-kunjungi-2-kabupaten-di-sulsel/;netral;jadwal resmi kampanye nasional prabowo gibran kunjung kabupaten sulsel
"Ahmad Muzani Ingatkan Kader Gerindra Kalbar Jaga Komitmen Prabowo-Gibran 
Maju Pilpres 2024";Viva;5/12/2023;https://www.viva.co.id/berita/politik/1664549-ahmad-muzani-ingatkan-kader-gerindra-kalbar-jaga-komitmen-prabowo-gibran-maju-pilpres-2024;netral;ahmad muzani kader gerindra kalbar jaga komitmen prabowo gibran maju pilpres
"Nasib Limbad Hadir di Kampanye Prabowo-Gibran, Ini Kata Andika Perkasa 
Wakil Ketua TPN Ganjar-Mahfud";Bangkapos.com;5/12/2023;https://bangka.tribunnews.com/2023/12/05/nasib-limbad-hadir-di-kampanye-prabowo-gibran-ini-kata-andika-perkasa-wakil-ketua-tpn-ganjar-mahfud;netral;nasib limbad hadir kampanye prabowo gibran andika perkasa ketua tpn ganjar mahfud
"Relawan Bolone Mase Jepara Makin Masif Kampanyekan Pemenangan 
Prabowo–Gibran di 2024";Liputan6.com;5/12/2023;https://www.liputan6.com/pemilu/read/5473240/relawan-bolone-mase-jepara-makin-masif-kampanyekan-pemenangan-prabowogibran-di-2024;netral;rawan bolone mase jepara masif kampanye menang prabowo gibran
Serangan Sudirman Said ke Jokowi Tak Mempan untuk Lemahkan Prabowo-Gibran;BeritaSatu.com;5/12/2023;https://www.beritasatu.com/bersatu-kawal-pemilu/2785133/serangan-sudirman-said-ke-jokowi-tak-mempan-untuk-lemahkan-prabowo-gibran;netral;serang sudirman said jokowi mempan lemah prabowo gibran
"AMIN Janji Terbitkan Perppu KPK, TKN Prabowo-Gibran: Pencegahan Lebih 
Penting - Jawa Pos";JawaPos.com;5/12/2023;https://www.jawapos.com/politik/013440238/amin-janji-terbitkan-perppu-kpk-tkn-prabowo-gibran-pencegahan-lebih-penting;netral;amin janji terbit perppu kpk tkn prabowo gibran cegah pos
"Gibran Ajak Anak-anak ke Panggung Terima Susu Gratis, Komisioner KPAI: 
Pelanggaran";Metro;5/12/2023;https://metro.tempo.co/read/1805466/gibran-ajak-anak-anak-ke-panggung-terima-susu-gratis-komisioner-kpai-pelanggaran;netral;gibran ajak panggung terima susu gratis komisioner kpai langgar
Jokowi dan Luhut Diklaim All Out Menangkan Prabowo-Gibran Pada Pilpres 2024;tvOneNews.com;5/12/2023;https://www.tvonenews.com/berita/nasional/172006-jokowi-dan-luhut-diklaim-all-out-menangkan-prabowo-gibran-pada-pilpres-2024;netral;jokowi luhut klaim all out menang prabowo gibran pilpres
"Ulama Banten, Abuya Muhtadi Bantah Dukung Prabowo-Gibran : Hanya Minta Doa, 
Bukan Dukungan";Tribunnews.com;5/12/2023;https://bangka.tribunnews.com/2023/12/05/ulama-banten-abuya-muhtadi-bantah-dukung-prabowo-gibran-hanya-minta-doa-bukan-dukungan;netral;ulama banten abuya muhtadi bantah dukung prabowo gibran doa dukung
TKD Prabowo-Gibran Sumut Targetkan 60 Persen Kemenangan;Indopos;5/12/2023;https://www.indopos.co.id/nusantara/2023/12/05/tkd-prabowo-gibran-sumut-targetkan-60-persen-kemenangan/;netral;tkd prabowo gibran sumut target menang
TKN Prabowo-Gibran: Kenaikan Anggaran Alutsista Sudah Disepakati APBN 2024;BeritaSatu.com;5/12/2023;https://www.beritasatu.com/nasional/2785151/tkn-prabowo-gibran-kenaikan-anggaran-alutsista-sudah-disepakati-apbn-2024;netral;tkn prabowo gibran anggar alutsista sepakat apbn
"Budiman Sudjatmiko Bilang Prabowo Bakal Bangun 10 Kota Metaverse, Pakar: 
Sulit Direalisasikan";Bisnis Tempo.co;5/12/2023;https://bisnis.tempo.co/read/1805330/budiman-sudjatmiko-bilang-prabowo-bakal-bangun-10-kota-metaverse-pakar-sulit-direalisasikan;netral;budiman sudjatmiko bilang prabowo bangun kota metaverse pakar sulit realisasi
Emang Iya Gibran Rakabuming Malah Menurunkan Suara Prabowo Subianto?;Suara.com;5/12/2023;https://www.suara.com/kotaksuara/2023/12/05/183924/emang-iya-gibran-rakabuming-malah-menurunkan-suara-prabowo-subianto;negatif;iya gibran rakabuming turun suara prabowo subianto
Timnas AMIN Curiga Media Center Buat Kepentingan Prabowo - Gibran;Katadata;5/12/2023;https://katadata.co.id/berita/nasional/timnas-amin-curiga-media-center-buat-kepentingan-prabowo-gibran/656f0abf91348;netral;timnas amin curiga media center prabowo gibran
"Perkuat Diplomasi Maritim, Kunci Prabowo-Gibran Perkuat Kedaulatan Wilayah 
NKRI - Kompasiana.com";Kompasiana.com;5/12/2023;https://www.kompasiana.com/mamanovsky/656fff55de948f6e6d5b69e2/perkuat-diplomasi-maritim-kunci-prabowo-gibran-perkuat-kedaulatan-wilayah-nkri;netral;kuat diplomasi maritim kunci prabowo gibran kuat daulat wilayah nkri kompasiana com
"TKN Prabowo-Gibran Tegaskan Tidak Ada Pengalihan Dana Bantuan Sosial dan 
Pendidikan";Tribun Kaltim;5/12/2023;https://kaltim.tribunnews.com/2023/12/05/tkn-prabowo-gibran-tegaskan-tidak-ada-pengalihan-dana-bantuan-sosial-dan-pendidikan;netral;tkn prabowo gibran alih dana sosial didik
"Jurus Anies-Muhaimin, Prabowo-Gibran, Ganjar-Mahfud Merebut Suara Perempuan 
di Pilpres 2024";KOMPAS.tv;5/12/2023;https://www.kompas.tv/video/466859/jurus-anies-muhaimin-prabowo-gibran-ganjar-mahfud-merebut-suara-perempuan-di-pilpres-2024;netral;jurus anies muhaimin prabowo gibran ganjar mahfud rebut suara perempuan pilpres
Kunjungan TKD Prabowo-Gibran di ANTARA Jatim - Foto ...;Antara News jatim;5/12/2023;https://jatim.antaranews.com/foto/751668/kunjungan-tkd-prabowo-gibran-di-antara-jatim;netral;kunjung tkd prabowo gibran jatim foto
Raih Simpati Masyarakat, Emak-Emak Pendukung Prabowo ...;Suara Jelata;5/12/2023;https://suarajelata.com/2023/12/05/raih-simpati-masyarakat-emak-emak-pendukung-prabowo-gibran-lakukan-bakti-sosial/;netral;raih simpati masyarakat dukung prabowo
Berebut Suara di Banten, TKD Tangsel Akan Hadirkan ...;Radar Banten;5/12/2023;https://www.radarbanten.co.id/2023/12/05/berebut-suara-di-banten-tkd-tangsel-akan-hadirkan-prabowo-subianto-saat-kampanye/;netral;rebut suara banten tkd tangsel hadir
